,ASIN,Title,ProductGroup,ProductTypeName
0,B06XRW26VW,"adidas Originals Baby Superstar I, White/Black/White, 5 M US Infant",Shoes,SHOES
1,B071LGH5BJ,"adidas Originals Superstar J, Ftwwht,Minblu,Ftwwht-B42368, 5.5 Medium US",Shoes,SHOES
2,B008VAZNDK,"adidas Toddler Boys' Iconic Tricot Jacket and Pant Set, Grey, 4T",Apparel,SHIRT
3,B071L2D7Q7,"adidas Big Boys' Tiro and Tricot Jackets, Black, L",Apparel,OUTERWEAR
4,B076Z6Q8BS,"adidas Boys' Tricot Jacket and Pant Set (4T, Cosmic Blue)",Apparel,SWEATER
5,B01MTYPTWX,"Adidas Big Boys' Clima Performance Logo Tee, Navy, M",Apparel,SHIRT
6,B01IO53JU0,"adidas Originals Boys' Gazelle C Sneaker, Collegiate Navy/White/White, 13 M US Little Kid",Shoes,SHOES
7,B06XX22Z3M,"adidas NEO Boys' Lite Racer K Sneaker, Grey/Grey/White, 1 M US Little Kid",Shoes,SHOES
8,B01DW6UAVW,"adidas Originals Kids' Stan Smith EL C Fashion Sneaker, White/White/Fairway, 13.5 M US Little Kid",Shoes,SHOES
9,B071Z2SNR2,"adidas Little Boys' Core Graphic Long Sleeve Tee, White, 5",Apparel,SHIRT
10,B01FY1XR9K,"adidas Originals Kids' Superstar Foundation EL C Sneaker, White/Black/White, 2 M US Little Kid",Shoes,SHOES
11,B06XWKY4R4,"adidas Originals Boys' X_PLR C Sneaker, Grey/Grey/White, 1.5 M US Little Kid",Shoes,SHOES
12,B0716RZ7BR,"Adidas Little Boys' Tricot Jogger, Black, 4",Apparel,PANTS
13,B01HNE15EU,"adidas NEO Boys' Baseline K Sneaker, White/Black/White, 2.5 Medium US Little Kid",Shoes,SHOES
14,B077KV3F3R,"Adidas Boys' Coast To Coast Hoodie (Dark Grey, M)",Sports,SPORTING_GOODS
15,B01NCSTP43,"adidas Originals Boys' Swift Run J Sneaker, Trace Green/Black/White, 4 M US Big Kid",Shoes,SHOES
16,B01N7C8935,"adidas Performance Boys' Rapidarun K Running Shoe, Scarlet/Scarlet/Black, 1.5 M US Little Kid",Shoes,SHOES
17,B01N59GKVZ,"adidas Performance Boys' Fortarun EL K Running Shoe, Scarlet/Black/White, 2 Medium US Little Kid",Shoes,SHOES
18,B075RN797J,adidas Kids Pharrell Williams Tennis HU White CP9804 (SIZE: 7),Shoes,SHOES
19,B07259FKQS,"adidas Big Boys' Athletic Pullover Hoodie, Black, L",Apparel,SWEATER
20,B01IO52CWG,"adidas Originals Boys' Gazelle J Sneaker, Collegiate Navy/White/White, 6 M US Big Kid",Shoes,SHOES
21,B01FLZ55KS,"adidas NEO Boys' VS Advantage Clean Cmf C Sneaker, White/White/Green, 13 Medium US Little Kid",Shoes,SHOES
22,B01MXUWLJU,"adidas NEO Big Kids' CF Racer TR K Sneaker,PETROL NIGHT/BLACK/WHITE,2 Medium US Big kid",Shoes,SHOES
23,B06XG2PXJQ,"Adidas Big Boys' Coast Pullover, Black, L(14/16)",Apparel,SHIRT
24,B0132JKKZ0,adidas Originals Stan Smith J White/Blue Leather 6 M US Big Kid,Shoes,SHOES
25,B07143MRWK,"adidas Originals Boys' Tubular Shadow J Sneaker, Core Black/White/Core Black, 5.5 M US Big Kid",Shoes,SHOES
26,B01GV1699W,"adidas NEO Boys' Raleigh 9TIS Mid K Sneaker, Black/White/Black, 11 Medium US Little Kid",Shoes,SHOES
27,B01MSX5TZB,"Adidas Big Boys' Tiro and Tricot Jackets, Caviar Black, XL",Apparel,OUTERWEAR
28,B01HH8WJVU,"adidas Performance Boys' Alphabounce j Running Shoe, Black/White/Utility Black, 6 Medium US Big Kid",Shoes,SHOES
29,B0748S4KQB,adidas Kids Unisex Incision Trail XJ (Little Kid/Big Kid) Black/Shock Pink/Solar Yellow 3.5 M US Big Kid,Shoes,SHOES
30,B01N0NIYEQ,"adidas NEO Boys' Cloudfoam Ultimate Sneaker, Grey Four/Solar Yellow/Matte Silver, 4 M US Little Kid",Shoes,SHOES
31,B01MTUM2HR,"adidas Performance Boys' Vigor Bounce c Running Shoe, Blue/Grey/Semi Solar Yellow, 3 Medium US Little Kid",Shoes,SHOES
32,B01N6DJVR7,"adidas NEO Boys' BB9TIS K Sneaker, White/Black/Blue, 12.5 Medium US Little Kid",Shoes,SHOES
33,B01NBBZIRV,"adidas Originals Boys' Swift Run C Sneaker, Black/Utility Black/Black, 1.5 Medium US Little Kid",Shoes,SHOES
34,B06XGPZP3J,"Adidas Little Boys' Team Trainer Pant Child, Navy/Green, 7",Apparel,PANTS
35,B075FJZWBQ,"Adidas Little Boys' Classic Pullover, Black, 7",Apparel,SHIRT
36,B01NCIDCQY,"adidas NEO Unisex-Kids Lite Racer Sneakers, Black/Black/Utility Black, (12 M US)",Shoes,SHOES
37,B01N1MCVCD,"adidas Performance Girls' Fortarun K,COLLEGIATE ROYAL/WHITE/COLLEGIATE NAVY,6 Medium US Little Kid",Shoes,SHOES
38,B010GU7G4Q,"adidas NEO Lite Racer K Kids' Running Shoe (Little Kid/Big Kid),Vivid Mint/Flash Pink/Solar Pink,4.5 M US Big Kid",Shoes,SHOES
39,B00LU82KHC,"adidas Performance Youth Tiro 15 Training Pant, Large, Black/White/Black",Sports,SPORTING_GOODS
40,B0722Y3V4L,"Adidas Little Boys' Active Two-Fer Tee Shirt, Solar Red, 6",Apparel,SHIRT
41,B076632B26,Adidas Kids Ultraboost J 5,Shoes,SHOES
42,B01MYTCE7A,adidas Kids  Boy's Alphabounce RC J (Big Kid) Core Red/Silver Metallic/Scarlet Athletic Shoe,Shoes,SHOES
43,B076VSBKTS,"adidas Boys Originals Trefoil Hoodie (Black/White, M)",Apparel,SWEATER
44,B01MXRVP9P,"adidas Performance Boys' Alphabounce Hpc Ams j Running Shoe, Medium Heather Grey/Grey Four/White, 6.5 Medium US Big Kid",Shoes,SHOES
45,B01NAM33I1,"adidas Originals Boys' Superstar C Sneaker, Grey Five/Utility Black/Metallic Gold, 13 Medium US Little Kid",Shoes,SHOES
46,B01MU46FE2,"adidas Performance Boys' Alphabounce Starwars j Running Shoe, White/Grey One/Black, 6 Medium US Big Kid",Shoes,SHOES
47,B0768NL48Z,"Adidas Boys Athletic Pants Black & White, Small (8)",Apparel,PANTS
48,B071L2D3PY,"adidas Big Boys' Athletics Jacket, Charcoal Grey Heather, S",Apparel,OUTERWEAR
49,B01LY1JL20,"adidas Youth Soccer Tiro 17 Pants, Small - Black/Shock Pink",Sports,SPORTING_GOODS
50,B01N6JH94B,"adidas Big Boys' Trainer Pant Youth, Dark Grey, L",Apparel,PANTS
51,B01N4BVVSM,"adidas Performance Unisex-Kids Seeley J Skate Shoe, Core Black, Ftwr White, Scarlet, 1.5 M US Little Kid",Shoes,SHOES
52,B01M0U9OE0,"Adidas Youth Big Boys Game Ready Hoodie And Pants Set, Green/ Grey",Sports,SPORTING_GOODS
53,B00QKRKDC2,"adidas Men's Soccer Tiro 15 Training Jacket, Black/White/Black, Large",Sports,SPORTING_GOODS
54,B01MTXCPK0,"adidas NEO Big kids' Daily Team K Sneaker,WHITE/WHITE/GREY ONE,4.5 Medium US Big Kid",Shoes,SHOES
55,B01JGLVXBI,"adidas Performance Unisex-Kids Adissage Comfort K Sport Sandal, Ftwr White, Solar Pink, Solar Pink, 5 M US Big Kid",Shoes,SHOES
56,B01N1V0I03,Adidas Boys Tracksuit Kids Track Top Pants Set Poly Jog Suit Blue New BP9334 (7/8 Years (128cm)),Apparel,SPORTING_GOODS
57,B07652WJ6K,"Adidas Boys 8-20 Climalite¨ Athletic Shirt (Medium / 10/12, Dark Grey Green)",Apparel,SHIRT
58,B01N1MFZ90,"adidas Boys' Adilette Clf+ Adj K Sandal, Collegiate Navy/Semi Solar Yellow/Semi Solar Yellow, 6 Medium US Big Kid",Shoes,SHOES
59,B01NBDW3RZ,"adidas Performance Boys' Alphabounce Em c Running Shoe, Grey Five/Grey Two/White, 2.5 Medium US Little Kid",Shoes,SHOES
60,B01A1HNTFO,"adidas NEO Boys' Baseline K Sneaker, Black/White/Black, 5.5 M US Big Kid",Shoes,SHOES
61,B01M07IW43,Adidas Superstar Foundation (Kids),Shoes,SHOES
62,B06XX3RVQ2,"Adidas Youth Big Boys Climalite Field Pant, Black, Medium",Apparel,PANTS
63,B0725JVG3M,"Adidas Big Boys' Athletic Pullover Hoodie, Blue, S",Apparel,SWEATER
64,B075RFMBSH,adidas Kids Unisex Baseline K (Little Kid/Big Kid) Black/White/Gum 3 M US Little Kid,Shoes,SHOES
65,B01MYXU63Q,"Adidas Big Boys' USA Tee, Navy, M",Apparel,SHIRT
66,B01D0R2RY6,"adidas Performance Boys' Crazylight Boost Low 2016 J Skate Shoe, Black/Infrared/Black, 6.5 M US Big Kid",Shoes,SHOES
67,B06XSBZ4T7,"adidas Originals Boys' Superstar Black Iridescent J Sneaker, Black/Black/Black, 6.5 M US Big Kid",Shoes,SHOES
68,B01HG7RI5Y,"adidas Boys Tennis Club Shorts, Black/White, X-Small",Sports,SPORTING_GOODS
69,B01EWP0X82,"adidas Big Boys' Active Hoodie, Granite/Unity Orange, Small/8",Apparel,SWEATER
70,B01EWP1PZM,"adidas Big Boys' Po Tech Fleece Hoodie, Black/Light Scarlet, X-Large/18",Apparel,SWEATER
71,B01N2NEL9A,"adidas Performance Boys' X 17.4 TF J Soccer Shoe, White/Energy Blue/Clear Grey, 12 Medium US Little Kid",Shoes,SHOES
72,B06Y1SDM13,"Adidas Youth Post Route Athletic Pullover Hoodie,Grey/ Sonic Red",Apparel,SWEATER
73,B073QWBF92,Adidas Kid's Stan Smith Pastel FTWWHT/FTWWHT/RAWPIN 4.0,Shoes,SHOES
74,B01MSX5NT7,"adidas Little Boys' Active Tee Shirt, Neon Green, 7X",Apparel,SHIRT
75,B01MYE6XJH,"adidas Performance Unisex-Kids Altasport K Sneaker, Ftwr White, Core Black, Ftwr White, 10.5K M US Little Kid",Shoes,SHOES
76,B01MT1U7KO,adidas Kids Unisex RapidaRun Lux C (Little Kid) Black/White Athletic Shoe,Shoes,SHOES
77,B01ATVIXNA,"adidas Big Boys' Tech Fleece Pant, Blue, X-Large/18",Apparel,PANTS
78,B01HQJS4NM,"adidas Performance Kids' Ace Tango J Indoor Soccer Cleat, White/White/Black, 4 M US Big Kid",Shoes,SHOES
79,B072W94588,Adidas Big Kids Ultra Boost black core black dark grey Size 4.0 US,Shoes,SHOES
80,B01HHAX0MU,"adidas Performance Boys' Alphabounce i Sneaker, Grey/Light Onix/Satellite, 5 M US Toddler",Shoes,SHOES
81,B075CR6WJQ,"adidas Originals Tubular Invader Strap I Fashion Sneaker, Mesa/Mesa/Owhite (Big Kid), 4.5 M US Big Kid",Shoes,SHOES
82,B01HHBP4T6,adidas Kids Boy's RapidaRun (Little Kid/Big Kid) Core Black/Core Black/Energy Athletic Shoe,Shoes,SHOES
83,B076PTQTTZ,Adidas x Pharrell Williams Big Kids Tennis HU J white footwear white tactile green Size 7.0 US,Shoes,SHOES
84,B01AI0TOVW,"adidas Little Boys' Short Sleeve Graphic Tee Shirt, Assorted, 5",Apparel,SHIRT
85,B01N0OQLRR,"adidas Originals Boys' Busenitz J Sneaker, White/Collegiate Royal/Metallic Silver, 13.5 Medium US Big Kid",Shoes,SHOES
86,B01LZ88C6D,BB8880 GRADE SCHOOL TUBULAR SHADOW J ADIDAS WHITE BLACK,Shoes,SHOES
87,B01L9T5GOA,"Adidas Big Boys Youth Game Ready Team Pants, White Black",Apparel,PANTS
88,B01N6WU0NI,"Kidas adidas Ultra Boost J, Triple White, 6Y",Shoes,SHOES
89,B01MTYPTCV,"Adidas Big Boys' Active Tee Shirt, Dark Blue, M",Apparel,SHIRT
90,B01M8PMI4H,Adidas Superstar (Kids),Shoes,SHOES
91,B01LZTV323,S76039 GRADE SCHOOL TUBULAR X PK J ADIDAS WHITE,Shoes,SHOES
92,B0117OBV3M,"adidas Originals Superstar CF I Kids Shoe (Infant/Toddler),White/White/Black,9 M US Toddler",Shoes,SHOES
93,B010S0BX70,"adidas Youth Soccer Condivo 16 Pants, Black/White, Small",Sports,SPORTING_GOODS
94,B0716SZ3R4,Adidas Kids Ace 17+ Purecontrol White/Core Black Soccer Shoes Soccer Shoes - 4Y,Shoes,SHOES
95,B010Q3KBRM,"adidas Performance D Rose 6 Boost J Shoe (Big Kid),Black/Purple/Gold,6.5 M US Big Kid",Shoes,SHOES
96,B01HON7T9U,Adidas Big Boys Youth 3-Stripe Mesh Performance Shorts,Apparel,SHORTS
97,B01LWAPWPP,"Adidas Big Boys Youth Game Time Fleece Pants, Black Br Yellow",Apparel,PANTS
98,B01A1HMZIG,"adidas NEO Boys' BB9TIS Mid Inf Sneaker, Black/Infrared/White, 7 M US Toddler",Shoes,SHOES
99,B01DS2SWRY,Adidas ACE 16.1 Junior FG Cleats [SHOBLU/FTWWHT/SESOSL] (1.5),Shoes,SPORTING_GOODS
100,B01HPFLCYK,"adidas Originals Boys' Tubular Shadow C Sneaker, Clear/Brown/Collegiate Silver/Black, 3 M US Little Kid",Shoes,SHOES
101,B01N7GAM1F,"adidas Toddler Boys' Striker Soccer Pant, Black/Red, 4",Apparel,PANTS
102,B076744RNV,adidas Originals Girls' 3-Stripes Trefoil T-Shirt,Sports,SPORTING_GOODS
103,B0742GVKVV,adidas Little Boys Training Marvel Spider-Man Hoodie (S),Apparel,SWEATER
104,B01MTKUXLB,"adidas Performance Boys' Alphabounce Ams j Running Shoe, Clear/Grey/Light Onix/Medium Grey Heather, 4 M US Big Kid",Shoes,SHOES
105,B01MQU3RNT,"Adidas Big Boys' Baselayer Top, White, M",Apparel,SHIRT
106,B00YFJ63Z8,"Adidas Little Boys' 3-piece Tracksuit (2T, Blue)",Sports,SPORTING_GOODS
107,B0744R5RK1,Adidas Jr Messi 16.3 IN Red/FtwWht/Cblack Shoes - 4.5Y,Shoes,SHOES
108,B06XFPNR4Y,adidas Kids  Boy's Short Sleeve Pattern Fill Logo Tee (Big Kids) Adi Black Medium,Apparel,SHIRT
109,B01NBB8L0Q,"adidas Boys Tennis Barricade Shorts, Black, Small",Sports,SPORTING_GOODS
110,B074NWY9SL,ultraBOOST uncaged j - Adidas,Apparel,APPAREL
111,B06XY8W8QW,adidas Kid's Messi 16+ Pureagility Soccer Cleat (5.5),Shoes,SHOES
112,B01N8SYYBD,"Adidas D Lillard 2 J boys basketball-shoes B39073_4 - CBLACK,CBLACK,CBLACK",Shoes,SHOES
113,B000RK8AGE,"adidas Kid's Triple Star 5 Mid J Baseball Cleat,Black/White,6 M",Shoes,SHOES
114,B071LQPMNJ,BY2125 GRADE SCHOOL ULTRABOOST J ADIDAS GREY,Shoes,SHOES
115,B0758KN43C,Adidas Athletics Pullover - Black Heather - Boys - 4,Apparel,SWEATER
116,B01LZ86N9G,Adidas Pro Model C Little Kids (PS) Shoes Black/Black by4394 (2.5 M US),Shoes,SHOES
117,B072LY66XF,adidas Kids Unisex Basketball Harden Vol.1 Shoes #BY3483 (5.5 M Big Kid),Shoes,SHOES
118,B01M0HYGQO,adidas Skateboarding Unisex Adi-Ease J (Little Kid/Big Kid) Core Black/Energy Blue/Energy Blue Athletic Shoe,Shoes,SHOES
119,B00IIT6ATK,"Adidas (Gs) Big Kids Crazy 8 J Basketball Shoes, Black, 5 M Us",Shoes,SHOES
120,B00GVA2E8O,adidas Kids Unisex Squad 13 Shorts (Little Kids/Big Kids) University Red/White XL (16 Big Kids),Sports,SPORTING_GOODS
121,B01N8XDZL1,"adidas Performance Boys' Crazy Time C Skate Shoe, Black/Black/Light Scarlet, 12 M US Little Kid",Shoes,SHOES
122,B01MQURPA7,Adidas Tubular Instinct Youth US 4.5 Black Tennis Shoe,Shoes,SHOES
123,B004RTJYI4,"adidas Little Boys' Active Mesh Short, Black, 5",Apparel,SHORTS
124,B01HG7RRYG,"adidas Boys Tennis Essex Trend Bermuda, Black/Glow Orange, Medium",Sports,SPORTING_GOODS
125,B019PKSSRM,adidas Kids Baby Boy's D Rose 7 (Infant/Toddler) Core Black/Ray Red/Core Black Sneaker 5 Toddler M,Shoes,SHOES
126,B014UT8YT0,Adidas Samoa Prf C Big Kids Style: B27473-FTWWHT/SOLRED Size: 1.5,Shoes,SHOES
127,B00KZ95J8E,adidas Kids Boy's Tech Fleece (Big Kids) Black/Scarlet MD (10-12 Big Kids),Apparel,OUTERWEAR
128,B01KGEXZN8,"Adidas Junior Big Kids Tubular X Pack Core Black Grey Leather Fashion Sneakers, 6",Shoes,SHOES
129,B01HG7QOA4,"adidas Boys Tennis Melbourne Line Bermuda, White/Mystery Blue, Large",Sports,SPORTING_GOODS
130,B014UTA3DA,ADIDAS Pre-School Samoa Running Shoes #B27472 (12 Little Kid M),Shoes,SHOES
131,B007SYCMXE,"adidas Performance Unisex Sereno Pants, Black, X-Large",Sports,SPORTING_GOODS
132,B01HO3YOYI,Adidas Kids Basketball Shoes NBA Youth Dual Threat BBall Mid Shoe Sport B72888 (EU 37 1/3 - UK 4.5 - US 5),Shoes,SHOES
133,B0083M1Q8W,"adidas Big Boys' Youth Sossto Short, White, Large",Apparel,SHORTS
134,B019HPUHFG,Adidas Kids ZX Flux J Syellow/Cblack/Ftwwht Running Shoe 7 Kids US,Shoes,SHOES
135,B010Q1JW92,"adidas Originals Crestwood Mid J Shoe (Big Kid), Black/Black/Black, 6.5 M US Big Kid",Shoes,SHOES
136,B01N6LXN7H,adidas Kids Boy's Full Court Shorts (Big Kids) Navy Shorts,Sports,SPORTING_GOODS
137,B077PL5PJP,Adidas Golden State Warriors Youth Authentic Hooded Sweatshirt (Youth Medium),Apparel,SWEATER
138,B01FIFG0ZK,"adidas Performance Boys' Adilette SC+ Thong k Flip Flop, Black/Semi Solar Slime/Black, 1 M US Little Kid",Shoes,SHOES
139,B010Q3LFD6,"adidas Performance D Rose 6 C Shoe (Little Kid),Dark Purple/Blast Purple/Blue,1.5 M US Little Kid",Shoes,SHOES
140,B00O41ZQH8,adidas Boy's Tiro 15 Tracksuit BlackWhite 8 Black,Apparel,SPORTING_GOODS
141,B0777SPZ9Y,"Adidas Boys' Sport Tricot Set (Bright Baby Blue, 7X)",Sports,SPORTING_GOODS
142,B073DCCBTK,Adidas Fusion Camo T-shirt - Bright Blue - Boys - L,Apparel,SHIRT
143,B01N76JHP9,Adidas Youth Tiro 17 Soccer Warm Top 2XS Dark Grey-Black-White,Apparel,SHIRT
144,B01GIBWWOG,Adidas Kids Basketball Shoes Outrival Training Bounce Sport B54112 Adiprene NBA (EU 38 - UK 5 - US 5.5),Shoes,SHOES
145,B016SLXY1G,Adidas D.Rose 6 Basketball Preschool Kid's Shoes Size 12,Shoes,SHOES
146,B01LZK21KP,adidas Tubular shadow I Shoes #BB8890 (7 Toddler M),Shoes,SHOES
147,B01N1V0GJK,Adidas Kids Tshirts Running Training Essentials Logo Tee White BK3488 Boys New (128 / 7-8 Years),Apparel,SPORTING_GOODS
148,B0777RWMHX,"Adidas Boys' Sport Tricot Set (Neon Green/Grey, 3T)",Sports,SPORTING_GOODS
149,B01HPH5SKM,adidas Tubular Shadow Knit I #BY2225 (8 toddler M),Shoes,SHOES
150,B01MXNEU1T,Adidas Youth Tiro 17 Soccer Rain Pant M Black-White,Apparel,PANTS
151,B01NH2VQ2D,adidas Kids Baby Boy's Full Court Shorts Set (Infant) Medium Blue Clothing Set,Sports,SPORTING_GOODS
152,B072JRYQP2,Adidas Junior Hockey Shoes - Aqua Blue - UK 12.5 Jnr,Shoes,SHOES
153,B01NAO9Q8Q,adidas NEO SE Daily TEAM K YOUTH BOYS SHOES (5),Shoes,SHOES
154,B075GP29F7,Adidas Boys Soccer Boots X15.4 FG Junior Firm Ground Molded Cleats B32788 New (5),Shoes,SHOES
155,B00R8NPXOK,"adidas Performance NXT LVL SPD Next Level Speed 3 K Basketball Shoe (Little Kid/Big Kid), Black/Solar Yellow/Black, 11.5 M US Little Kid",Shoes,SHOES
156,B01M9ER35N,Adidas Zx Flux Youth US 3.5 Multi Color Sneakers,Shoes,SHOES
157,B019ZU3QRE,"Adidas D Rose 773 IV Boys Basketball Shoes Size US 4, Regular Width, Color Red",Shoes,SHOES
158,B01N4J4BCX,adidas Kids Boy's Smokescreen Base Layer Top (Big Kids) Caviar Black Small,Sports,SPORTING_GOODS
159,B06WGNFTDN,"adidas Junior Freak Football Cleats (4.5, White/White/Platinum)",Shoes,SHOES
160,B01BI49Q4C,"Adidas Youth Big Boys Downtown Athletic Track Pants (Large (14/16), Navy/Light Blue)",Apparel,PANTS
161,B01866JNPM,Adidas Condivo 16 Youth Soccer Rain Jacket M Black-Vista Grey,Sports,SPORTING_GOODS
162,B01N5KJDEO,adidas Kids Boy's Undefeated Top (Big Kids) Red Large,Sports,SPORTING_GOODS
163,B01MT4C3UV,Adidas Kids Soccer Shoes Ace 17.4 Turf Junior Football Futsal Boots BA9247 New (EU 32 - UK 13.5k - US 14k),Shoes,SPORTING_GOODS
164,B001CGYJZS,"adidas Little Kid/Big Kid Goletto TRX HG Soccer Cleat,Black/Diva/Running White,5.5 M US Big Kid",Shoes,SHOES
165,B0161KVSUI,adidas Ace 15.1 FG/AG J Leather,Shoes,SHOES
166,B010S0MMLQ,"adidas Performance Boys Club Bermuda, Black, Large",Sports,SPORTING_GOODS
167,B01MRCUTL8,Adidas Stan Smith (Kids),Shoes,SHOES
168,B00XK9K4PE,Adidas Outrival K Basketball Kid's Shoes Size 7,Shoes,SHOES
169,B006OQJZJG,"adidas F5 TRX FG Soccer Cleat (Little Kid/Big Kid),Black/Lab Lime/Metallic Silver,6 M US Big Kid",Shoes,SHOES
170,B00XGN3SQ6,adidas Youth AC Milan Training Jersey 15/16 (Large) Black/Victory Red,Sports,SPORTING_GOODS
171,B015QGB8L2,adidas New York Knicks Promo Fleece Hoodie - Boys 8-20 LARGE,Apparel,PANTS
172,B01A1HCYZU,"adidas Performance Boys' Cloudfoam VS City K Sneaker, Black/Matte Silver/Infrared, 7 M US Big Kid",Shoes,SHOES
173,B072F9Q6YW,"Adidas Big Boys Youth Cotton Fleece Slim Pants (Large (14/16), Grey/Red)",Apparel,PANTS
174,B01NCWAO7V,adidas Youth Large Manchester United Hoodie Jacket (Small) Real Red/Black,Apparel,SWEATER
175,B006IXMHJU,Adidas ClimaLite NCAA FORMOTION Elite Socks,Sports,SPORTING_GOODS
176,B071CRRK9P,"adidas JR X 16.1 FG Solar Green Soccer Cleats, Size 4.5",Shoes,SHOES
177,B019XJVJLC,"adidas Toddler Boys' Active Logo Shorts, Dark Indigo/Solar Red, 2T",Apparel,SHORTS
178,B00HLSMZAC,Stephen Curry Golden State Warriors Adidas Youth Boys Blue Gametime Player Shirt (Youth XL 18),Sports,SPORTING_GOODS
179,B01LZK241I,Adidas Tubular Shadow J BB8881 (4),Shoes,SHOES
180,B01BKP05N0,"Adidas Youth Big Boys Football Shirt (Large (14/16), Gray/Red)",Apparel,SHIRT
181,B013RMD3BA,"Adidas Crazy Light Boost Boys Basketball Shoes Size US 5.5, Regular Width, Color Onix/Scarlet/Black",Shoes,SHOES
182,B00R8NIEFK,"adidas Performance Outrival 2 K Basketball Shoe (Little Kid/Big Kid), Light Grey/Silver/Black, 10.5 M US Little Kid",Shoes,SHOES
183,B01N5RQ4JP,Adidas Kids Shoes Boys Soccer Cleats X 17.3 FG Youth Football Boots New S82369 (EU 38 2/3 - UK 5.5 - US 6),Shoes,SHOES
184,B01NAKXEWT,Stephen Curry #30 Golden State Warriors Adidas Youth Climalite Alternate Shirt (Large),Apparel,SHIRT
185,B01GLV59ZW,Adidas Kids Mexico 3Stripes Soccer Track Jacket XS Green-White,Apparel,OUTERWEAR
186,B071L6HDLH,Adidas Youth Simmons Sixers Name/Number Tshirt ROYAL YL,Sports,SPORTING_GOODS
187,B015Y8P2BO,Adidas Top Ten Low (Kids),Shoes,SHOES
188,B00PH5W2I6,adidas Superstar J Kids Trainers White Black - 5 UK,Shoes,SHOES
189,B01D53CEDY,Adidas ACE 16.1 Prime Knit Junior FG Cleats [SHOBLU/SESOSL/FTWWHT] (5.5),Shoes,SHOES
190,B00W6YJXRY,"adidas Little Boys' Warmup Fleece Pant, Grey/Blue, 2T",Apparel,PANTS
191,B00HVKKCKA,Adidas Boys 2-7 3-Piece Tracksuit Set 2T Bright Red,Sports,SPORTING_GOODS
192,B06XTBL15M,"Adidas Junior's Olympics Performance Polo (Red, Medium)",Apparel,SHIRT
193,B00OHSOWIW,Adidas NBA Toddler Oklahoma City Thunder Zip Up Hoodie (2T),Sports,SPORTING_GOODS
194,B00C40V4AY,"adidas Performance Wheelhouse Shoe (Little Kid/Big Kid), Core Black/Running White/Metallic Silver, 3.5 M US Big Kid",Shoes,SHOES
195,B01HKETS24,Wisconsin Badgers Adidas Youth Black 3-Stripe Performance Sweatpants (Youth Large),Apparel,PANTS
196,B01MXD0OVD,Adidas Infant/Toddler Boy's Impact Track Pant & Jacket 2-Piece Black Set Sz. 18M,Sports,SPORTING_GOODS
197,B00M0VK4PI,"adidas Performance P Absolado Instinct Firm-Ground J Soccer Cleat (Little Kid/Big Kid), Light Flash Yellow/White/Dark Shale, 4 M US Big Kid",Shoes,SHOES
198,B00R8NO5WG,"adidas Performance X 15.4 Soccer Shoe (Little Kid/Big Kid), Yellow/Midnight Indigo/Flash Red, 5.5 M US Big Kid",Shoes,SHOES
199,B00GYS8Y3M,adidas Outdoor Winterfun Boy Primaloft Winter Boot - Kid's Collegiate Navy/Dark Onix/Blue Beauty - 3,Shoes,SHOES
200,B01NCKLAWE,Adidas Boys Ultimate SS Graphic T-Shirt yellow XL,Sports,SPORTING_GOODS
201,B01J97D1CI,"adidas Youth Cushioned 6pk Crew Sock, White/Black/Light Onyx, Large",Sports,SPORTING_GOODS
202,B01MY15BLM,"adidas Boys' Ace Tango 17.3 TF J Soccer-Shoes, Solar Red/Black/Solar Orange, 11 Medium US Little Kid",Shoes,TECHNICAL_SPORT_SHOE
203,B01N8RH6SL,"adidas Originals Boys' ZX Flux EL I Sneaker, Tactile Blue Tactile Blue Tactile Blue S, 10 M US Toddler",Shoes,SHOES
204,B01N4C0S8I,"Adidas Big Boys' Smoke Screen Performance Short, Gry Grn, XL",Apparel,SHORTS
205,B01D0TWBIQ,"adidas Performance Kids' Ace 16.3 Primemesh Firm / Artificial Ground Soccer Cleats, White/Black/Metallic Gold, 13.5 M US Little Kid",Shoes,SHOES
206,B06Y3DN2Y5,"adidas HVC 2 K Youth Wrestling Shoes, Grey/Solar Red/Grey, Size 13K",Shoes,SHOES
207,B00NB7OKMS,"adidas Golf Boys 3 Stripes 1/2 Zip Shirt, Red/Night Marine, Large",Sports,SHIRT
208,B01NBHNYXM,"Adidas Big Boys' Full Court Clima Top, Medium Blue, XL",Apparel,SHIRT
209,B010Q1KWV4,"adidas Originals Samoa Sneaker (Little Kid/Big Kid), Mineral Blue/Yellow/White, 7 M US Big Kid",Shoes,SHOES
210,B01N1Q9HHE,"adidas Originals Boys' Matchcourt J Skate Shoe, Black/White/Black, 13.5 Medium US Big Kid",Shoes,SHOES
211,B074N4H3P8,Adidas - Boy's Pro Model BT J Sneakers (Big Kid),Shoes,SHOES
212,B01I36A3IG,adidas Originals Kids Boy's Linear Overlay (Little Kids/Big Kids) Black Medium,Sports,SPORTING_GOODS
213,B00LG6DF8Q,adidas 11Questra TF Soccer Boots Cleats Shoe - Black/White/Orange - Boys - 1.5,Shoes,SHOES
214,B01HN167RS,"adidas Performance Boys' Adilette Clf+ Adj K Sandal, Collegiate Royal/White/Collegiate Royal, 1 M US Little Kid",Shoes,SHOES
215,B073DDQ57H,Adidas Fusion Camo T-shirt - Grey Heather Body Solar Yellow - Toddler - 7X,Apparel,SHIRT
216,B01HP1RU1I,"adidas Originals Kids' ZX Flux K Skate Shoe, Black/Black/Black, 11 M US Little Kid",Shoes,SHOES
217,B01HO3YOVG,Adidas Kids Basketball Shoes Youth DT BBall Mid Shoes Sport B72887 Adiprene NBA (EU 36 2/3- UK 4 - US 4.5),Shoes,SHOES
218,B00PG9R2F6,"Columbia University NCAA Big Boys 3 Stripe Track Jacket, Grey (Medium (10-12), Grey)",Sports,SPORTING_GOODS
219,B01D0THOGA,"adidas Performance Kids' Wheelhouse 4 K Baseball Cleat, White/Light Onix/Semi Solar Green, 13 M US Little Kid",Shoes,SHOES
220,B075Z6QZFL,"adidas Youth Atlanta United Big Logo Black T-Shirt, (S)",Sports,SPORTING_GOODS
221,B06XG46XHH,Chelsea F.C. Adidas Football Club Youth Dri-Fit Shirt (Large),Apparel,SHIRT
222,B01MT62BO3,Adidas 3 Stripes Youth Dark Grey / EQT Yellow Performance Active Track Jacket (Size Small 8),Sports,SPORTING_GOODS
223,B00THDOD3G,Adidas Colombia Home Youth Jersey-BYELLO (XS),Sports,SPORTING_GOODS
224,B071GNH2NK,adidas Originals Tubular Shadow J Grey Two Textile 6.5 M US Big Kid,Shoes,SHOES
225,B01N1XJXBO,Adidas Kids Shoes Soccer Cleats X 16.3 Firm Ground Football Unisex BB5695 (EU 32 - UK 13.5k - US 14k),Shoes,SHOES
226,B06XR7DNSY,Adidas Tubular Invader Strap Lifestyle Shoes (Grey),Shoes,SHOES
227,B06WVJJQKJ,Adidas - Messi 163 TF - BA9859 - Color: Golden-Black - Size: 4.5,Shoes,SPORTING_GOODS
228,B010NNDEZG,"adidas Performance Force Bounce K Shoe (Little Kid/Big Kid), Pink/Yellow/Blue, 6.5 M US Big Kid",Shoes,SHOES
229,B0731DJ3LB,Adidas ZX FLUX J Youth US 5 Multi Color Sneakers,Shoes,SHOES
230,B01MD0V42T,Adidas Superstar Triple Red C Little Kid's Shoes Ray Red/Ray Red/Black b27525 (1.5 M US),Shoes,SHOES
231,B075BQSR8H,adidas Harden Youth MVP Sweatshirt L Dark Burgundy,Apparel,SWEATER
232,B01KTY40CK,Adidas PRO MODEL J boys fashion-sneakers B39373_4 - Bright Cyan/White/Bright Cyan,Shoes,SHOES
233,B07846ZM8P,Adidas Illinois Fighting Illini Youth Allegiance Hooded Sweatshirt (Youth Medium),Apparel,SWEATER
234,B075B1TD4Y,adidas Harden MVP Pant M Maroon,Apparel,PANTS
235,B010Q0WQ8W,"adidas Performance Ace 15.3 FG AG J Soccer Shoe (Little Kid/Big Kid),Black/Metallic Silver/Shock Mint,5 M US Big Kid",Shoes,SHOES
236,B010Q1MTG0,"adidas Performance X 15.3 TF J Soccer Shoe (Little Kid/Big Kid),Gold/Black/Shock Pink,11 M US Little Kid",Shoes,SHOES
237,B004S2SY4A,"adidas Baby Boys' Long Sleeve Tee and Pant Set, Adi Lucid Green Heather, 24 Months",Apparel,SHIRT
238,B00LG6EZN0,"adidas Performance Messi 10.3 Firm-Ground J Soccer Cleat (Little Kid/Big Kid), Power Teal Running White/Warning, 11 M US Little Kid",Shoes,SHOES
239,B00VUV4HWA,Adidas X 15.3 TF Shoes - Bold Orange/White/Solar Orange - Boys - 1.5,Shoes,SHOES
240,B003KDKS6A,Adidas Chicago Bulls Youth (Sizes 8-20) Primary Logo Hoodie Small,Sports,SPORTING_GOODS
241,B00SHN91PW,Adidas Kids F50 FG J Solred/Ftwwht/Cblack Soccer Cleat 5 Kids US,Shoes,SHOES
242,B01HKE0UBW,Chicago Bulls Adidas Youth Fleece Performance Sweatpants (Large),Apparel,PANTS
243,B01MDMB8E0,adidas Originals Kids Logo Knit Scarf - Grey,Sports,SPORTING_GOODS
244,B00D2ZGN74,Adidas Calissage 2.0 Slides - Black/Metal Silver/Vivid Yellow (Boys) - 2,Shoes,SHOES
245,B00D396U40,Adidas Predito Ablsolado LZ TRX FG J Soccer Cleats Shoes - Vivid Berry (Little Kid/Big Kid) - 1.5,Shoes,SHOES
246,B00R8NWSKM,"adidas Performance Ace 15.4 Indoor Soccer Shoe (Little Kid/Big Kid), Black/White/Solar Yellow, 2.5 M US Little Kid",Shoes,SHOES
247,B077PFSN3C,"Adidas Little Boys' Tricot Jacket and Pant 2-Piece Set, Grey Green Yellow, Size 5",Apparel,SWEATER
