,ASIN,Title,ProductGroup,ProductTypeName
1000,B00R8NJRZG,Adidas X 15.3 TF Shoes - Solar Yellow/Solar Yellow/Core Black - Boys - 2,Shoes,SHOES
1001,B007SYCJ5K,"Adidas Samba Classic Leather Soccer Shoe (Toddler/Little Kid/Big Kid),Black/Running White,6 M US Big Kid",Shoes,SHOES
1002,B01GWUORHI,"adidas Toddler Boys' Striker Soccer Pant, Dark Indigo, 4",Apparel,PANTS
1003,B01MU1HTZU,Adidas Superstar (Kids),Shoes,SHOES
1004,B06XH4KY3Q,Adidas Jr Samba Classic Black/RunWht Soccer Shoes - 4Y,Shoes,SHOES
1005,B00YHDVQ1S,"adidas Performance D Rose 5 Boost J Kids' Basketball Shoe (Big Kid), Scarlet/Solar Blue, 6 M US Big Kid",Shoes,SHOES
1006,B077PYG997,Adidas Samoa Reptile Preschool Kid's Shoes Size 13,Shoes,SHOES
1007,B00LG6C2T4,"adidas Performance Conquisto Firm-Ground J Soccer Cleat ,Black/White/Solar Pink,4 M US Big Kid",Shoes,SHOES
1008,B019PKT0CY,adidas Kids Boy's D Rose 7 (Big Kid) Core Black/Scarlet/Core Black Sneaker 5 Big Kid M,Shoes,SHOES
1009,B00M6F8XSS,"adidas Boys' Triple Up Short (X-Large, White/Scarlet)",Apparel,SPORTING_GOODS
1010,B076J19RKW,Adidas Boy's Athletic Pants Black & White (Medium (10/12)),Apparel,PANTS
1011,B01N1QISCO,Adidas Youths Gazelle 2 Grey Leather Trainers 4 US,Shoes,SHOES
1012,B00ED3CR60,ADIDAS Striker 13 Short - Youth (COBALT) (YXL),Sports,SPORTING_GOODS
1013,B01M0UZ3L2,Adidas Kid's Tubular Shadow J Big Kids Casual Shoe,Shoes,SHOES
1014,B01HQIDC2G,"adidas Performance Boys' Messi 16.3 TF J Skate Shoe, Blue/White/Warning, 5 M US Big Kid",Shoes,SHOES
1015,B076XQDTQQ,Kansas Jayhawks Boys Youth Player Hooded Sweatshirt - Hoodie (Youth Medium - 10/12),Sports,SPORTING_GOODS
1016,B071Y6DQ96,adidas Superstar C Kids Trainers Black White - 13 UK,Shoes,SHOES
1017,B01N4Q9TSO,"Adidas Little Boys Fleece Pullover Hoodie (6, Gray)",Sports,SPORTING_GOODS
1018,B01N4KTJYZ,adidas Kids Baby Boy's Full Court Shorts Set (Infant) Bright Green Clothing Set,Sports,SPORTING_GOODS
1019,B077KZ8S9X,"Adidas Boys' Influencer Shorts (Black/Blue, XL)",Sports,SPORTING_GOODS
1020,B077KX84LX,"Adidas Boys' Dynamic Sport T-Shirt (Red Orange, M)",Sports,SPORTING_GOODS
1021,B07798XP1G,adidas CONDIVO 18 SHORT Size XXL LUCORA/ORANGE/UNIINK,Sports,SPORTING_GOODS
1022,B073ZJQ1GD,Adidas Originals T-shirts - Adidas Originals Ju...,Apparel,SPORTING_GOODS
1023,B01MRUKXIV,"adidas Men's Athletics Essential Tricot 3-Stripe Pants, Collegiate Navy/White, X-Large",Sports,SPORTING_GOODS
1024,B01A6VU1E2,"adidas Men's Badge of Sport Graphic Tee, Collegiate Royal/White, X-Large",Sports,SPORTING_GOODS
1025,B01N6ISAZ4,"adidas Men's Essentials 3-Stripe Tricot Track Jacket, Black/White, XX-Large",Sports,SPORTING_GOODS
1026,B01N1U8P34,"adidas Men's Essentials 3-Stripe Pullover Hoodie, Collegiate Navy/White, Medium",Sports,SPORTING_GOODS
1027,B01MU2KC7X,"adidas Men's Essentials 3-Stripe Full Zip Fleece Hoodie, Dark Grey Heather/Black, Small",Sports,SPORTING_GOODS
1028,B010DL3T0I,"adidas Men's Condivo 16 Training Pants, Black/White, X-Large",Sports,SPORTING_GOODS
1029,B01GP2Z8GM,"adidas Men's Soccer Tiro 17 Pants, X-Large, Black/White/White",Sports,SPORTING_GOODS
1030,B00LLSDBX8,"adidas Originals Men's Superstar Casual Sneaker, White/Core Black/White, 11.5 M US",Shoes,SHOES
1031,B06XL18MH7,"adidas Originals Men's Superstar Foundation Casual Sneaker, Black/Black/Black Snake, 11 D(M) US",Shoes,SHOES
1032,B00JCU8HOU,"Adidas Men's Originals Stan Smith Sneaker, White/White/Fairway, 6.5 M US",Shoes,SHOES
1033,B01NCAZPKC,"adidas Men's Alphabounce Em m Running Shoe, Black/White/Utility Black, 10 Medium US",Shoes,SHOES
1034,B01NCFCU7L,"adidas Men's Swift Run Shoes,Mystery Blue/White/Matte Silver,11 M US",Shoes,SHOES
1035,B00QVAX4F6,"adidas Men's Athletics Essential Track Jacket, Black/White, Medium",Sports,SPORTING_GOODS
1036,B01MQVTM4X,"adidas Originals Men's Tubular Shadow Sneaker, Vapour Grey/Vapour Grey/Raw Pink, 10 Medium US",Shoes,SHOES
1037,B01N5MTUHZ,"adidas Performance Men's Galaxy 3 Wide m Running Shoe, Black/Black/Black, 9.5 W US",Shoes,SHOES
1038,B00LOU4P88,"adidas Performance Men's Tiro Training Pant, XX-Large, Black/White/Black",Sports,SPORTING_GOODS
1039,B0106J670Q,"adidas Originals Men's Seeley Skate Shoe,Black/White/Gum,9 M US",Shoes,SHOES
1040,B00PEZAQM8,"adidas NEO Men's SE Daily Vulc Lifestyle Skateboarding Shoe,Black/Black/White,8.5 M US",Shoes,SHOES
1041,B01LWYN8BO,"adidas Performance Men's Speed 3.0 Cross-Trainer Shoes, Black/Metallic Silver/White, (9.5 M US)",Shoes,SHOES
1042,B01HNQ68D6,"adidas Men's Athletics Essential Linear Logo Pull Over Hoodie, Black/White, Medium",Sports,SPORTING_GOODS
1043,B01IDSPHUS,"adidas Men's Originals Relaxed Strap Back Cap, One Size, White/Black",Sports,SPORTING_GOODS
1044,B01NAL408V,"adidas Men's Badge Of Sport Classic Long-Sleeve Tee, Black/Dark Grey, Medium",Sports,SPORTING_GOODS
1045,B01NH32FVJ,"adidas Neo Men's CF Racer TR, Black/Black/Running White, 9.5 M US",Shoes,SHOES
1046,B01HNQ3G9U,"adidas Men's Essentials Performance Logo Pants, Black/White, Medium",Sports,SPORTING_GOODS
1047,B01CT5IDAM,"adidas Neo Men's Daily Fashion Sneaker, Grey/Tech Grey/White, 13 M US",Shoes,SHOES
1048,B06XDLHTPW,"adidas Originals Men's X_PLR Sneaker, Sesame/Black/Sesame, 11 M US",Shoes,SHOES
1049,B01HSN4P4I,"adidas Men's Shoes | Cloudfoam Advantage Sneakers, White/Black/White, (9.5 M US)",Shoes,SHOES
1050,B0007PNA0U,"adidas Men's Samba Classic Soccer Shoe,Black/Running White,14 M US",Shoes,SHOES
1051,B01H67X6RS,"adidas Performance Men's Energy Cloud Wtc m Running Shoe, Grey/Tech Grey/Clear/Grey, 12 M US",Shoes,SHOES
1052,B01A1E8952,"adidas NEO Men's Cloudfoam Race Running Shoe, Black/White/Tech Grey, 11.5 M US",Shoes,SHOES
1053,B01KYQJZPK,Adidas Kids Superstar J Originals White/Black/White Basketball Shoe 4.5 Kids US,Shoes,SHOES
1054,B00XC1D3J4,"adidas Men's Athletics Essential Woven Jacket, Black/Black/White, Medium",Sports,SPORTING_GOODS
1055,B06XX5WC83,"adidas Originals Men's Busenitz Sneaker, Mesa/Brown/Gold Metallic, 13 M US",Shoes,SHOES
1056,B01N9JUVTZ,"adidas Performance Men's Energy Cloud m Running Shoe, Black/White/Utility Black, 9.5 Medium US",Shoes,SHOES
1057,B01MU2P5AS,"adidas Men's Training Ultimate Long Sleeve Tee, Black, X-Large",Sports,SPORTING_GOODS
1058,B01N6GW32N,"adidas Originals Women's Gazelle W Sneaker, Pearl Grey/Trace Green/White, 6 M US",Shoes,SHOES
1059,B071Z59YGX,Adidas Men's Tubular Nova Originals Tactile Green/Lgh Solid Grey/Dark Grey Running Shoe 8.5 Men US,Shoes,SHOES
1060,B01HNWY20Q,"adidas Men's Soccer Tiro 17 3/4 Pants, Black/White, Large",Sports,SPORTING_GOODS
1061,B01NBMXPIJ,"adidas Performance Men's Pureboost Dpr Running Shoe, Black/Black/White, 9.5 Medium US",Shoes,SHOES
1062,B01NCNUK4E,"adidas Originals Men's Pro Model Sneaker, Black/White/Tactile Gold, 10 Medium US",Shoes,SHOES
1063,B01HPKKNKY,"adidas Men's Training Ultimate Short Sleeve Tee, Mystery Red Heather, Medium",Sports,SPORTING_GOODS
1064,B0761Y6N9J,"adidas Men's Originals Trefoil Tee (S, VividRed/White)",Sports,SPORTING_GOODS
1065,B01NCFBA8P,"adidas NEO Men's Cloudfoam Super Daily Sneaker, Grey Three/Black/White, 11 Medium US",Shoes,SHOES
1066,B07469N8R3,Adidas Tubular Doom Sock Primeknit Mens Shoes White/White/Black by3558 (9 D(M) US),Shoes,SHOES
1067,B0757XMRM8,Adidas Men's Eqt Support Adv Running White-11,Shoes,SHOES
1068,B06XKGZ4PK,Adidas Men's EQT Support Adv Originals Core Black/Core Black/Sub Green Training Shoe 11 Men US,Shoes,SHOES
1069,B077P21QPT,"adidas Men's climacool Engineered Heather Stripe Golf Polo(Mid Grey, XL)",Sports,SPORTING_GOODS
1070,B010S8NCXK,"adidas Performance Men's Adilette SC+ Slide M Nature C Sandals,Grey/Grey/Vista Grey,12 M US",Shoes,SHOES
1071,B01N5D96Q5,adidas Skateboarding Unisex Superstar Vulc Grey Four/Core Black/Gold Metallic Athletic Shoe,Shoes,SHOES
1072,B01HNQ60IE,"adidas Men's Athletics Essential Linear Logo Pull Over Hoodie, Black/White, X-Large",Sports,SPORTING_GOODS
1073,B01HSMWJAG,"adidas Men's Shoes | Cloudfoam Advantage Clean Sneakers, White/White/Fairway, (10 M US)",Shoes,SHOES
1074,B06WWR8KMY,"adidas Men's Paramount Beanie, Onix/Grey Marl/Scarlet, One Size",Sports,SPORTING_GOODS
1075,B01N7G56RY,adidas Skateboarding Unisex Adi-Ease Collegiate Navy/Footwear White/Collegiate Navy 12 Women / 11 Men M US,Shoes,SHOES
1076,B01FXKG4JW,"adidas NEO Men's Shoes | Raleigh 9TIS Mid Basketball, Black/White/Black, (11 M US)",Shoes,SHOES
1077,B01MRZZ1K4,"adidas Men's Originals Trefoil Chain Snapback Cap, Olive Cargo/Black, One Size",Sports,SPORTING_GOODS
1078,B072QGGJT9,"adidas Men's Ultra Boost ST, Black/Red, 9.5 D(M) US",Shoes,SHOES
1079,B072C3XHZD,adidas Men's NMD_XR1 PK Black/Grey BY1910 (SIZE: 10),Shoes,SHOES
1080,B01N6J5V9Z,"adidas Performance Men's Pureboost, White/Grey One/White, 9.5 Medium US",Shoes,SHOES
1081,B0007PNA6O,"adidas Men's Samba Millenium Soccer Shoe,Black/Running White/Gold,11 M US",Shoes,SHOES
1082,B01HOB72YO,"adidas Men's Designed-2-Move Shorts, Black, Large",Sports,SPORTING_GOODS
1083,B01MU2P9A9,"adidas Men's Athletics Essential Cotton 3 Stripe Pants, Medium Grey Heather/Black, X-Large",Sports,SPORTING_GOODS
1084,B01HSNAJ70,"adidas NEO Men's Cloudfoam Super Daily Sneakers, White/White/Matte Silver, (10 M US)",Shoes,SHOES
1085,B072M23WNC,"adidas Mens Adizero Reflective Snapback Cap, Black/Multi-Reflective/Onix, One Size",Sports,SPORTING_GOODS
1086,B06X9BNJ8D,"adidas Men's Originals Trefoil II Knit Beanie, Black, One Size",Sports,SPORTING_GOODS
1087,B01H678RX6,"adidas Performance Men's Vigor Bounce m Trail Runner, Black/Shock Slime/Black, 12 M US",Shoes,SHOES
1088,B01A1ELSPA,"adidas NEO Men's Baseline Fashion Sneaker, Collegiate Navy/Tech Grey/White, 8 M US",Shoes,SHOES
1089,B00QVAYMO8,"adidas Men's Essentials Track Pants, Black/Black/White, Small",Sports,SPORTING_GOODS
1090,B0754793NG,"adidas Originals Mens Tubular Invader Strap Shoes (13, Easy Blue)",Shoes,SHOES
1091,B01N30M2O3,"adidas NEO Men's CF Racer TR Hiking Shoes, Running White/Black/Running White, (11 M US)",Shoes,SHOES
1092,B01MZ1P17E,"adidas Men's Athletics Essential Cotton Pullover Hoodie, Medium Grey Heather/Black, Medium",Sports,SPORTING_GOODS
1093,B01N2KCVZP,"adidas Performance Men's Aerobounce m Running Shoe, Grey Two/Metallic Silver/Grey Five, 12 Medium US",Shoes,SHOES
1094,B019EBAF28,"adidas Men's Basketball Slim 3 Stripe Sweatpants, Black/White, XX-Large",Sports,SPORTING_GOODS
1095,B01MYNGVGD,Adidas Mens Tiro 17 Training Jacket Black/White M,Sports,SPORTING_GOODS
1096,B075ZB8BQT,"Men's adidas Springblade Pro, Grey/Silver, 13 D",Shoes,SHOES
1097,B01IDWFP1K,adidas Men's Origingals Trefoil 6-pack No Show Sock,Sports,SPORTING_GOODS
1098,B01N3O7GBJ,"ADIDAS Classic T-Shirt, Burgundy, Small",Sports,SPORTING_GOODS
1099,B01N0HDMA3,"adidas Performance Men's Alphabounce Rc m, Core Black/Utility Black/White, 10.5 M US",Shoes,SHOES
1100,B01MZ1TSMK,"adidas Men's Essentials 3 Stripe Tapered & Cuffed Pants, Black/White, X-Small",Sports,SPORTING_GOODS
1101,B01HSNB92E,"adidas Men's Swift Run Shoes,Black/White/White,10.5 M US",Shoes,SHOES
1102,B06XWQ95S6,"adidas Men's Campus Sneaker, Black/Black/Tactile Red, 12 M US",Shoes,SHOES
1103,B01N7HXDGJ,"adidas Performance Men's Powerlift.3.1 Cross Trainer, Scarlet/Energy/Collegiate Burgundy, 10.5 Medium US",Shoes,SHOES
1104,B01HNQMA92,"adidas Men's Athletics Jersey Shorts, Medium Grey Heather, Large",Sports,SPORTING_GOODS
1105,B01MT1B4MJ,"adidas Performance Men's Shoes | Adidas Athletics 24/7 Training, Dark Heather Grey/Crystal White/Black, (11 M US)",Shoes,SHOES
1106,B06XX4GZN5,adidas Skateboarding  Men's Seeley Black/Black/Footwear White Canvas 9.5 D US,Shoes,SHOES
1107,B06X9H374F,"adidas Men's Eclipse Reversible Beanie, Black/Power Red/Dark Grey Heather/Onix, One Size",Sports,SPORTING_GOODS
1108,B06XNM4ND5,"Adidas Men's EQT Sneakers,Black/wht,12",Shoes,SHOES
1109,B01NALFNA7,"adidas Men's Climalite X Ii 2-Pack Crew Socks, Black Graphite Marl/Black/Light Onix/Collegiate Burgundy, Large",Sports,SPORTING_GOODS
1110,B00LF1VV06,"adidas Men's Core 15 Training Pants, Black/White, Small",Sports,SPORTING_GOODS
1111,B01NGTXQEK,adidas Skateboarding  Men's Clima 2.0 Tee Blue Night Small,Sports,SPORTING_GOODS
1112,B01A08PXKS,"adidas Performance Men's Athletics Essential Tricot Jogger Pants, Small, Black/White",Sports,SPORTING_GOODS
1113,B01M4INC2B,"adidas NEO Men's Raleigh Mid Lace-Up Shoe (9.5 D(M) US, Black/Red/Black)",Shoes,SHOES
1114,B072QDDD4Q,Adidas Men's UltraBOOST Uncaged Running Shoe (Sz. 11) White,Shoes,SHOES
1115,B01NBIJ3XI,"adidas Originals Men's Adi-Ease, Core Black/Core Black/Core Black, 11 M US",Shoes,SHOES
1116,B01N7KRMZ8,"adidas Men's Galaxy Trail m Running Shoe, Utility Black/Grey Five/Energy, 12 Medium US",Shoes,SHOES
1117,B01H643JK0,"adidas Men's Ultraboost Running Shoe, White/White/Crystal White, 10 M US",Shoes,SHOES
1118,B01AYILYRU,"adidas Performance Men's Pureboost ZG M Running Shoe, Crystal White/Crystal White/Solid Grey, 9.5 M US",Shoes,SHOES
1119,B07576PZGR,"Adidas Men's Tapered Weekender Drawstring Pants, White Stripes (Large, Conavy Msilve)",Sports,SPORTING_GOODS
1120,B01HPKMGHW,"adidas Men's Training Ultimate Short Sleeve V Neck Tee, Black, X-Large",Sports,SPORTING_GOODS
1121,B0764KPB7Y,"adidas Men's Originals Trefoil Hoodie (XL, White/Black)",Sports,SPORTING_GOODS
1122,B01MUC3KWH,Adidas Originals Superstar Relaxed Men's Track Jacket Black bk3612 (Size S),Sports,SPORTING_GOODS
1123,B071K8416D,Adidas Men's EQT Support ADV Running Sneakers Black Black Size 8.5 D (US),Shoes,SHOES
1124,B01N2UIRVD,"adidas Performance Men's Alphabounce Hpc Ams m Running Shoe, Medium Grey Heather/Grey/White, 8.5 M US",Shoes,SHOES
1125,B005CWQL5E,"adidas Performance Men's Superstar 3G Slide Sandal,White/Black/Silver,10 M US",Shoes,SHOES
1126,B074STSBS4,"Iniki Runner in Collegiate Navy/White/Gum by Adidas, 11",Shoes,SHOES
1127,B01MRG269T,Adidas Mens Tiro 17 Training Shorts Black/White M,Sports,SPORTING_GOODS
1128,B01N9JUXP0,"adidas Performance Men's Speed Trainer 3 SL Baseball Shoe, Black/Metallic Silver/White, 12 Medium US",Shoes,SHOES
1129,B01JHL5UTS,"adidas Men's Superlite No Show Socks (6 Pack), White/Black/Onyx/Black, Large",Sports,SPORTING_GOODS
1130,B010MQKPI8,"adidas NEO Men's Cloudfoam VS City Shoes,Black/Metallic Silver/Yellow,8 M US",Shoes,SHOES
1131,B077J9B1T2,"Adidas Swift Run Mens in Grey/Black by, 7.5",Shoes,SHOES
1132,B01MRZLN5C,"adidas Men's Athletics Sport Id Jersey Pullover Hoody, Medium Grey Heather/Black/Reflective Silver, Medium",Sports,SPORTING_GOODS
1133,B00IY9D948,"adidas Men's Essentials 3-Stripe Shorts, Black/White, X-Large",Sports,SPORTING_GOODS
1134,B00SST67C0,"Adidas B39895 Men's Kurobe II Water Shoes, Vista Grey/Core Black/Core Black, 9 M US",Shoes,SHOES
1135,B01HSNCBVM,"adidas Men's Shoes | Cloudfoam Super Daily, Black/Black/White, (10 M US)",Shoes,SHOES
1136,B01NGYFTH4,"adidas Men's Athletics Essential 3 Stripe Crew Sweatshirt, Black/White, X-Large",Sports,SPORTING_GOODS
1137,B073XVG2GD,Adidas NEMEZIZ 17.1 Firm Ground Cleats [LEGINK] (8.5),Shoes,SHOES
1138,B019FUCRRY,"adidas Performance Men's Essential Tech Tee, Medium, Dark Grey Heather",Sports,SPORTING_GOODS
1139,B01MT10JHZ,"adidas Men's Essentials 3 Stripe Wind Pants, Collegiate Navy/Collegiate Navy/White, Large",Sports,SPORTING_GOODS
1140,B01MZ1TNB9,"adidas Men's Running Response Shell Jacket, Dark Burgundy, X-Large",Sports,SPORTING_GOODS
1141,B01N9EZYY7,Adidas Ultra Boost Running Shoes - AW17-13 - Black,Shoes,SHOES
1142,B01MU0FESB,"adidas Originals Gazelle Sneaker,TRACE GREEN/BLACK/METALLIC GOLD,7.5 Medium US",Shoes,SHOES
1143,B077J8J2LR,Adidas Predator 18.1 FG Cleats [Cblack] (6.5),Shoes,SHOES
1144,B072S8CHKS,"Iniki Runner in Core Black/White by Adidas, 9.5",Shoes,SHOES
1145,B01LPARM2W,"adidas Men's Edge Rc m Running Shoe, Black/Black/Granit, 13 Medium US",Shoes,SHOES
1146,B010N5YMYG,"adidas NEO Men's Cloudfoam Ilation Mid Basketball Shoe,White/Black/Metallic Silver,9 M US",Shoes,SHOES
1147,B000VQX320,"adidas Originals Men's Adissage Slides,New Navy/New Navy/Running White,7 M",Shoes,SHOES
1148,B01MQVTL1N,"adidas Originals Men's Tubular Shadow Sneaker, Vapour Grey/Vapour Grey/Raw Pink, 12 Medium US",Shoes,SHOES
1149,B01HPKKNKO,"adidas Men's Training Ultimate Short Sleeve Tee, Dark Grey Heather, Medium",Sports,SPORTING_GOODS
1150,B01H67BQNE,"adidas Performance Men's Rockadia Trail M Running Shoe, Black/Black/Energy, 10.5 M US",Shoes,SHOES
1151,B077PKZZVB,"adidas Men's Predator 18+ FG Soccer Cleat (Sz. 11.5) Black, Solar Red",Shoes,SHOES
1152,B01A6CLYGK,"adidas Men's Team Issue Fleece Pullover Hoodie Hoodie, X-Large, White/White",Sports,SPORTING_GOODS
1153,B01N78I9BH,"adidas Men's Athletics Essential Tricot 3 Stripe Tapered Pants, Black/White, Large",Sports,SPORTING_GOODS
1154,B01N55W8ZZ,"adidas Men's Energy Cloud Wtc m Running Shoe, Talc/White/Grey Two, 10.5 Medium US",Shoes,SHOES
1155,B01HC75MRO,"adidas Men's Training Speed Breaker Hype Shorts, Trace Green, 4X-Large",Sports,SPORTING_GOODS
1156,B06X9HDZFM,"Adidas Mens Griggs Brimmer, Black, One Size",Sports,SPORTING_GOODS
1157,B075M1K7TX,adidas Originals Men's Pharrell Williams Human Race White/White/Raw 10.5 D US,Shoes,SHOES
1158,B074B4PL1S,adidas Men's Pharrell Williams Tennis HU Blue/Pink/Light Grey BY2671 (SIZE: 10.5),Shoes,SHOES
1159,B06Y1F2ZS1,adidas Skateboarding  Men's Samba ADV Footwear White/Core Black/Gum 5 9 D US,Shoes,SHOES
1160,B01NAL8NBN,"adidas Men's Athletics Sport Id Jersey Pants, Black, Medium",Sports,SPORTING_GOODS
1161,B077MVZ78Z,"Adidas Men's Modern Varsity Training Hoodie,Navy",Sports,SPORTING_GOODS
1162,B07587B88Z,Adidas Busenitz Vulc RX (White/Collegiate Burgundy/Bluebird) Men's Skate Shoes-9.5,Shoes,SHOES
1163,B074JG65ZM,Adidas Ultraboost Laceless Men's Running Shoes Core Black s80770 (9 D(M) US),Shoes,SHOES
1164,B06XDM3Q9K,adidas Originals  Men's Long Sleeve Pique Tee Maroon Medium,Sports,SPORTING_GOODS
1165,B0163A1EJ6,"adidas Condivo16 Track Suit (L, Black/Vista Grey)",Sports,SPORTING_GOODS
1166,B01FMAV1JQ,New Adidas Men's 3-Stripes Tiro Pants Black Medium,Sports,SPORTING_GOODS
1167,B06X9K53QW,"adidas Men's Pine Knot Beanie, Heathered Onix, One Size",Sports,SPORTING_GOODS
1168,B07658STGX,"adidas Men's Ace Tango 17.3 Turf Soccer Cleats (Black/Black, 9.0)",Sports,SPORTING_GOODS
1169,B018SV6YC0,"Adidas S78504 Men's Adissage 2.0 Logo Slides, Core Black/Matte Silver, 13.5 M US",Shoes,SHOES
1170,B01KYPBUMC,"Adidas Mens Adidas Athletics Men's Tiro Training Pant, Black/Black, Small",Sports,SPORTING_GOODS
1171,B06Y3HWL2B,Adidas Tubular Nova Primeknit,Shoes,SHOES
1172,B0778WSST2,"Adidas Iniki Runner in Grey/Core Black/White, 11",Shoes,SHOES
1173,B01NCK22Y9,"adidas Originals Men's Seeley, Collegiate Navy/Black/White, 13 Medium US",Shoes,SHOES
1174,B01LYSJA2R,adidas Men's Originals Beacon II Snapback Black/Black Hat,Sports,SPORTING_GOODS
1175,B01MRZG1KG,"adidas Men's Classic Badge Sport Graphic Tee, Black/White, Medium",Sports,SPORTING_GOODS
1176,B01HSNXSJG,"adidas Men's Shoes | Cloudfoam Super Skate Sneakers, Black/White/Lime, (12 M US)",Shoes,SHOES
1177,B01NBJP80H,"adidas Performance Men's Shoes | Ball 365 Inspired Basketball, Black/Utility Black/White, (11 M US)",Shoes,SHOES
1178,B01IDTX30S,"adidas Men's Originals Sock (6 Pack), Large, Crew Black/White",Sports,SPORTING_GOODS
1179,B01NCF5O95,"adidas NEO Men's CF Advantage CL Sneaker, Collegiate Navy/Blue, 10 Medium US",Shoes,SHOES
1180,B0784J48Y9,Adidas Men's EQT Cushion Adv Originals Black Training Shoe 8.5 Men US,Shoes,SHOES
1181,B077MX1S56,adidas Tubular Doom,Shoes,SHOES
1182,B077NM8TX7,adidas Response Lt,Shoes,SHOES
1183,B073SG4J7D,"adidas Men's Terrex Swift R Running Shoes (11.5 D(M) US, Blue/Black/White)",Shoes,SHOES
1184,B01NA6J6LU,"adidas Men's Adizero Prime Knit Cap, One Size, Black/Onix",Sports,SPORTING_GOODS
1185,B01NCLD613,"adidas Men's Shoes | Barricade 2017 Tennis, Equipment Yellow/White/Lemon Peel, (9.5 M US)",Shoes,SHOES
1186,B0108RA2XY,"adidas Men's Athletics Essential Cotton Fleece Full Zip, Black/Black, Medium",Sports,SPORTING_GOODS
1187,B01N2WI0HA,"adidas Men's Adizero II Cap, Ratio Onix/Grey/Black, One Size",Sports,SPORTING_GOODS
1188,B0773MSSMW,adidas X Tango 16.1 TF,Shoes,SHOES
1189,B06X9HL4QQ,"adidas Men's Pine Knot Beanie, Black, One Size",Sports,SPORTING_GOODS
1190,B01HJDV5WC,"adidas Originals Men's Tubular Radial Fashion Sneaker, Dark Grey Heather/Dark Grey Heather/Medium Grey Heather, 6 M US",Shoes,SHOES
1191,B01N7BDL25,adidas ID Stadium Jacket - Mens - Grey - X-Large,Apparel,SPORTING_GOODS
1192,B00S41LV9G,Adidas Men's Entry Tracksuit Training Poly Jog Suit Training Set Navy New S22638 (XL 48/50),Apparel,SPORTING_GOODS
1193,B00QD87Z1A,Adidas Men's Essentials Woven Tracksuit Track Top Pants Training Set Black S22466 (UK 38/40 (Manufacturer size 174)),Apparel,SPORTING_GOODS
1194,B06XX8292T,"adidas Performance Men's Goletto VI TF Soccer Shoe, Black/White/Solar Green, 7 M US",Shoes,SHOES
1195,B06XWYHDG8,"adidas Performance Men's Adizero Adios m Running Shoe, White/Trace Grey Metallic/Solar Yellow, 8.5 M US",Shoes,SHOES
1196,B074BC54D7,Adidas Mens PW Tennis Human Race Brown/Pink Fabric Size 7,Shoes,SHOES
1197,B01HNQ90E0,"adidas Men's Athletics Essential Track Jacket (Extended Sizes), Black/Print, XX-Large/Tall",Sports,SPORTING_GOODS
1198,B01N0Q6PEN,"adidas Performance Men's X 17.3 FG Soccer Shoe, Solar Yellow/Legend Ink/Legend Ink, 13 Medium US",Shoes,SHOES
1199,B01NAGSI1Z,Adidas Samba ADV Skate Shoes (12),Shoes,SHOES
1200,B01MTY84I0,adidas Skateboarding  Men's Adiease Premiere X Bonethrower Collegiate Navy/Footwear White/Core Black 12 D US,Shoes,SHOES
1201,B01J55A5VO,"adidas Men's Relaxed Performance Climalite Boxer Brief Underwear (2 Pack), Bold Blue/Urban Sky, Medium",Sports,SPORTING_GOODS
1202,B01A68S0J8,"adidas Performance Men's Duramo 7 m Trail Runner, Black/Metallic/Silver/Light Onix, 10.5 M US",Shoes,SHOES
1203,B01I0DA0HQ,"adidas Performance Men's Alphabounce Ams m Running Shoe, Grey/Clear Onix/Medium Grey Heather, 8.5 M US",Shoes,SHOES
1204,B076KD8DTZ,adidas Mens Seeley OG ADV Skateboard Sneaker (11),Shoes,SHOES
1205,B01N4DM73I,"adidas Men's Shoes | Copa 17.2 Firm Ground Cleats Soccer, Solar Yellow/Legend Ink/Legend Ink, (10 M US)",Shoes,SHOES
1206,B077N7D4DL,adidas Busenitz 10 Yr Anniv,Shoes,SHOES
1207,B01MXHX41H,"adidas Men's NEO Cloudfoam Race WTR Sneaker,Mesa/Dark Brown/Craft Chill,US 14 M",Shoes,SHOES
1208,B0183PUUL2,adidas Men's Team Ultimate LS Top Grey XXL,Sports,SPORTING_GOODS
1209,B0185JJETU,"adidas Men's Sport Performance Climacool 9"" Midway Underwear (2 Pack), Semi Solar Slime/Urban Sky, Large",Sports,SPORTING_GOODS
1210,B073V59LJP,Adidas Barricade 7 Novak Pro Men's Tennis Shoe Core Navy/White/Red (10.5),Shoes,SHOES
1211,B06XX48QNX,"adidas Performance Men's Adizero Tempo 9 m Running Shoe, Grey/Black/Solar Yellow, 10.5 M US",Shoes,SHOES
1212,B01N2WHXPW,"adidas Mens Amplifier Stretch Fit Cap, Core Blue Looper Print, Small/Medium",Sports,SPORTING_GOODS
1213,B01MRZMKEV,"adidas Performance Men's Dame 4, White/Black/Scarlet, 9 Medium US",Shoes,SHOES
1214,B0771WSS3D,"Adidas Men's UltraBOOST Uncaged Running Shoe (Sz. 9.5) White, Grey Heather",Shoes,SHOES
1215,B01N9HAQG6,"adidas Men's Shoes | Adizero Ubersonic 2 Tennis, Black/Equipment Yellow/Grey Five, (9.5 M US)",Shoes,SHOES
1216,B01N6IWQBU,"adidas Men's Training Essential Color Block Tech Tee, Noble Ink/Mystery Ink, Medium",Sports,SPORTING_GOODS
1217,B0007YG9AO,"adidas Men's 3-Stripe Pant, Black/White, Medium",Sports,SPORTING_GOODS
1218,B01MU36X9J,"Adidas Mens Sport Performance Climacool 2 Pack Boxer Brief Underwear, Colornameinternal| black/Semi Solar Slime, X-Large",Sports,SPORTING_GOODS
1219,B01NA9N9U6,"adidas Performance Men's Supernova m Running Shoe, Utility Black/Black/Solar Orange, 9.5 Medium US",Shoes,SHOES
1220,B01I5RBR88,"Adidas Men's Ultimate Core Short (Large, Navy)",Sports,SPORTING_GOODS
1221,B01NBJHIMI,"adidas Performance Men's Nemeziz 17.3 FG Soccer Shoe, Legend Ink/Solar Yellow/Energy Blue, 11 Medium US",Shoes,SHOES
1222,B01MT14EM0,"adidas Men's Soccer Tango Pants, Black/White, X-Large",Sports,SPORTING_GOODS
1223,B01LX68SD2,Adidas Mens Gazelle Medium Grey Scarlet Suede Trainers 7.5 US,Shoes,SHOES
1224,B01M7XUIPN,Adidas Youth Tiro 17 Training Jacket Black/White L,Sports,SPORTING_GOODS
1225,B075XNVCWP,Adidas Go To Performance S/S Tshirt MCFGREY L,Sports,SPORTING_GOODS
1226,B0784M2TDG,Adidas Pharrell Williams Hu Aop Tee Mens Style: BR1830-Black/White Size: L,Shoes,SHOES
1227,B0784G4564,"Adidas Originals Men's X_plr Running-Shoes (Mens 9, Olive Red 6461)",Shoes,SHOES
1228,B0783RH49L,Adidas Men's UltraBOOST Laceless Running Shoe White/Black Size 8.5 M US,Shoes,SHOES
1229,B077R9L215,Adidas Crdo Windbreaker Mens Style: AY7729-VIVRED/LEGINK Size: M,Shoes,SHOES
1230,B077QXC6HC,ADIDAS Mens Originals NMD_R2 CQ2399 (9 M US),Shoes,SHOES
1231,B077PYFV99,Adidas Superstar Rt-Pharrel Casual Men's Shoes Size 9.5,Shoes,SHOES
1232,B077ND7L6R,adidas Matchcourt ADV,Shoes,SHOES
1233,B077N74WQ5,adidas Sm D Lillard 2 Pk NCAA,Shoes,SHOES
1234,B077MYDN6C,Adidas Men's Crazy 8 ADV PK Night Cargo/Night Cargo Basketball Shoe 11 Men US,Shoes,SHOES
1235,B0721RBY7J,Adidas Adizero Accelerator Cleat Unisex Track Field 7.5 Black-White-Orange,Shoes,SHOES
1236,B071KGRTH1,Adidas Adizero Ambition 4 Cleat Women's Track Field 5.5 Black-White-Orange,Shoes,SHOES
1237,B01B3RVIM2,"adidas Men's Shoes | Voloomix Slide Sandals, Black/Metallic Silver/Black, (5 M US)",Shoes,SHOES
1238,B0743K6YR5,Men's Adidas Respone LT Running Shoe Dark Grey/Black/White Size 10.5 M US,Shoes,SHOES
1239,B01H0N2ZT8,"adidas Men's Shoes | Adilette CF+ Mono Athletic Slide Sandals, Scarlet/Light Scarlet/Light Scarlet, (12 M US)",Shoes,SHOES
1240,B0753KCP4L,adidas Men's Adizero Ubersonic 2 Pharrell Williams Chalk White/Dark Blue/Scarlet CG3086 (SIZE: 10),Shoes,SHOES
1241,B00HZU1FPW,"adidas Performance Men's Thrasher 1.1 M Trail Running Shoe, Core Black/Metallic/Silver/Light Onix, 7.5 M US",Shoes,SHOES
1242,B01N4GKMTR,"adidas Mens Originals 3-Stripes Trainer, Black/White, One Size",Sports,SPORTING_GOODS
1243,B073RRY53N,"Adidas Men's ClimaMid Performance Shorts (Medium, Grey Black)",Sports,SPORTING_GOODS
