,ASIN,Title,ProductGroup,ProductTypeName
747,B06XFQY9WD,adidas Kids Boy's Field Goals Tee (Big Kids) Adi Black Large,Apparel,SHIRT
748,B074CNZ38Q,Adidas Athletics Pullover - Dark Grey - Youth - S,Apparel,SWEATER
749,B06XFY2GPN,adidas Kids Boy's All Star Training Top (Big Kids) Solar Green Small,Apparel,SHIRT
750,B01M9B8IXQ,"ADIDAS Classic Boys T-Shirt, Black, Large",Sports,SPORTING_GOODS
751,B06W9L31GY,"Adidas Youth Big Boys Tech Fleece Pullover Hoodie, Blue",Apparel,SWEATER
752,B075G583H1,ADIDAS TREFOIL TRACK SUIT 6M (6 MONTHS),Sports,SPORTING_GOODS
753,B01MZ4V0S8,adidas Kids  Boy's Field Tee (Big Kids) White/Red Large,Sports,SPORTING_GOODS
754,B01ATWENME,Adidas Boys 8-20 Black Shock Net Performance T-Shirt (X-Large / 18 Big Kids),Sports,SPORTING_GOODS
755,B01KRYEBYE,"Adidas Youth Big Boys Three Stripe Polo Shirt (Small (8), Dark Grey/ Safety Yellow)",Sports,SPORTING_GOODS
756,B074ZSHXG4,adidas Originals Boys Graphic T-Shirt (L),Apparel,SHIRT
757,B00LH1A1T6,"adidas Performance Chilwyanda FITFOAM K Thong Sandal (Little Kid/Big Kid), Night Flash/Solar Pink/Solar Pink, 11.5 M US Little Kid",Shoes,SHOES
758,B06Y39CSPL,"adidas Mat Wizard Youth Wrestling Shoes, Energy Red/Yellow/Black, Size 1.5",Shoes,SHOES
759,B01A51GFFW,"adidas Big Boys' Active Pant, DGH Solid Grey Heather, Medium/10-12",Apparel,PANTS
760,B071RRQ934,adidas Kids Boy's Slam Dunk Tee (Big Kids) Grey T-Shirt,Apparel,SHIRT
761,B019F4MOBY,"Adidas Little Boys' Iconic Tricot Jacket and Pant Set, Grey, 7",Apparel,SWEATER
762,B019QRATAI,"adidas Performance Kids' X 16.3 Indoor Soccer Cleats, Solar Red/Metallic Silver/Red, 11 M US Little Kid",Shoes,SHOES
763,B01HSOQQI0,"adidas NEO Boys' VS Set Cmf Inf Sneaker, Collegiate Navy/Electricity/Running White, 5 M US Toddler",Shoes,SHOES
764,B06XGLDY1X,adidas Kids  Boy's Long Sleeve Base Layer Top (Big Kids) Black Shirt,Apparel,SHIRT
765,B071F4K5DN,Adidas Kids Messi 16+ Fg Copper Metallic/Core Black/Solar Green Soccer Shoes - 4Y,Shoes,SHOES
766,B01NH097ZW,adidas Kids Baby Boy's Compete Tee (Toddler/Little Kids) Turquoise Heather T-Shirt,Sports,SPORTING_GOODS
767,B01NACR4UP,"adidas Performance Boys' Ace Tango 17.3 in J Soccer Shoe, White/Solar Yellow/Black, 11 Medium US Little Kid",Shoes,SHOES
768,B01N02ZFPD,Adidas Youth Tiro 17 Soccer Training Jacket XL Bold Blue-Black-White,Sports,SPORTING_GOODS
769,B071S99H9D,"Adidas Big Boys 5-Piece Active Clothing Bundle, Multi Color Bundle, X-Large",Apparel,SHIRT
770,B0195KSHZU,"adidas Performance Kids' Busenitz J Sneaker (2 Little Kid M, Ash/Cinder/Ash)",Shoes,SHOES
771,B01MY4M289,adidas Youth Boys' 3G Speed Active Shorts Dark Grey / EQT Blue (Youth X-Large 18-20),Sports,SPORTING_GOODS
772,B01NH0PKOS,Lionel Messi Adidas Youth Player Endorsement White Performance T-Shirt (Medium),Apparel,SHIRT
773,B01LZT3RYC,Adidas USA Hockey Athletics Youth World Cup of Hockey Pullover Hoodie Sweatshirt (Large 14/16),Apparel,SWEATER
774,B01LPAQEIA,adidas Kids Unisex D Lillard 2 C (Little Kid) Light Solid Grey/Solar Rred/Ice Green Sneaker 13.5 Little Kid M,Shoes,SHOES
775,B01B6EBGCE,"Adidas Soccer Cleats Size 6 - Ace 16.1 FG/AG Junior, Green/Pink/Black",Toy,TOYS_AND_GAMES
776,B072R1YB2Y,adidas Kids Boys Running Shoes AltaSport Cloudfoam Training School S81058 New (US 11K),Shoes,SHOES
777,B01FN1WON6,Adidas Energy Boost ESM J Running Junior's Shoes Size 5,Shoes,SHOES
778,B01MG5HUQU,Boys adidas REVIGO 17 GoalKeeper Jersey Junior For Soccer,Sports,SPORTING_GOODS
779,B01LXXJ9SU,"adidas Performance Kids' X 16.3 Firm Ground Soccer Cleat, Solar Green/Black/Core Green, 5.5 M US Big Kid",Shoes,SHOES
780,B01HINVKQY,"Adidas Big Boys Youth Athletic Tech Fleece Pants, Grey/ Blue",Apparel,PANTS
781,B00J4RBZG8,"Adidas Wheelhouse 2K MID BSBL Boys Baseball Shoes Size US 2.5, Regular Width, Color Black/White",Shoes,SHOES
782,B01MTYPRKN,"adidas Toddler Boys' Active Tank Top, Grey, 4",Apparel,SHIRT
783,B01D0THIMK,"adidas Performance Kids' X 16.3 Firm Ground Soccer Cleats, White/Black/Metallic Gold, 5 M US Big Kid",Shoes,SHOES
784,B01IDYRZU2,"Adidas Youth Big Boys Ultimate Climawarm Pants, Grey",Apparel,PANTS
785,B019NOB6DS,"adidas Big Boys' Active Short, Black, X-Large/18",Apparel,SHORTS
786,B0765RN9QC,adidas Youth Crazy Explosive Short XS White-Collegiate Navy,Sports,SPORTING_GOODS
787,B00LUMUTSA,"adidas Energy Running Single Mid-Crew Socks, Vista Grey/Night Flash Purple, Large",Sports,SPORTING_GOODS
788,B00HZ5VQFQ,"adidas Team Speed Traxion Crew Socks, Light Orange/White/Aluminum 2, Medium",Sports,SOCKSHOSIERY
789,B012CNSQSK,"adidas X 15.3 FG/AG Blue Junior Soccer Cleats, Size 4",Shoes,SHOES
790,B019HDTDKI,"adidas Originals Boys' Active Trefoil Hoodie, Scarlet/White, X-Small",Apparel,SWEATER
791,B00PYF7WKW,adidas Men's Daily Grey/Grey/Timber Sneaker 8.5 D - Medium,Shoes,SHOES
792,B00HSC0MC4,Adidas Squadra 13 Shorts Big Kids Style : S22591,Sports,SHOES
793,B01GRLFFV4,"adidas Performance Kids' Ace 16.4 J Turf Soccer Cleat, Red/White/Black, 5 M US Big Kid",Shoes,SHOES
794,B06XY71HSP,"Adidas Boys Tubular X K (5 M US Big Kid, Black/Onix/Scarlet)",Shoes,SHOES
795,B01I2AX95W,"adidas Performance Boys' Barricade 2016 Xj Skate Shoe, Mystery Blue/Easy Blue/Glow Orange, 1 M US Little Kid",Shoes,SHOES
796,B0744R1LJF,Adidas Samba Millenium Kids Shoes Black/Run Wht/Noir/Blanc Shoes - 4Y,Shoes,SHOES
797,B009SP0OZY,"adidas Big Boys' Loose Core Pant, Black/Scarlet, X-Large",Apparel,PANTS
798,B075TGQTR6,"adidas Kid's NEMEZIZ 17+ 360 Agility FG Soccer Cleats, 5.0 D(M) US, Solar Orange / Solar Red / Solar Red",Shoes,SHOES
799,B019XJW0PQ,"adidas Toddler Boys' Active Stripe Short, Black&Blue, 2T",Apparel,SHORTS
800,B00D72JR8E,"Adidas Wrestling HVC Youth Laced Wrestling Shoe (Toddler/Little Kid/Big Kid),Black/White/Gum,3.5 M US Big Kid",Shoes,SHOES
801,B075ZRBP4Y,"adidas Youth Triple Stripe Pull-Up Pants, (Black, S)",Sports,SPORTING_GOODS
802,B01N1FC7UQ,Adidas Boys' Contrast Tricot Track Suit - Mercury Grey - 12 Months,Sports,SPORTING_GOODS
803,B00VUX829C,"adidas Performance Messi 15.3 FG AG J Soccer Shoe (Little Kid/Big Kid), White/Prime Blue/Black, 6 M US Big Kid",Shoes,SHOES
804,B073T9JXV3,Adidas - Alphabounce Ams J - BW0576 - Color: Black-Graphite - Size: 6.0,Shoes,SHOES
805,B01MR12PP2,adidas Kids Baby Boy's Legend Tee (Toddler/Little Kids) Grey 6,Sports,SPORTING_GOODS
806,B07657GK8X,Adidas Toddler Boys Bright Red Poly Fleece Athletic Pullover Hoodie 3T,Apparel,SWEATER
807,B01N4KTPTZ,adidas Kids Baby Boy's Defender Shorts Set (Infant) Red Shorts,Sports,SPORTING_GOODS
808,B01HQFGCQ2,"adidas Performance Kids Ace 17.3 J Turf Soccer Cleat, BLACK/WHITE/BLUE, 1.5 M US Little Kid",Shoes,SHOES
809,B077PY7N4Z,Adidas D.Rose 6 Basketball Preschool Kid's Shoes Size 2,Shoes,SHOES
810,B077H259N9,Adidas 2018 Howzat FS Spike Cricket Shoes - Junior - White - UK 2,Shoes,SHOES
811,B06WLNL7TZ,Adidas D Lillard 3 Youth US 6 Black Basketball Shoe,Shoes,SHOES
812,B01MS2IL7L,adidas Kids Boy's Influencer Shorts (Big Kids) Gold Shorts,Sports,SPORTING_GOODS
813,B013C4V2HK,Adidas Zx Flux Pink Youths Trainers Size 4.5 UK,Shoes,SHOES
814,B01MRISGNZ,Adidas Youth MESSI 16.1 Firm Ground Cleats [DKGREY] (3),Shoes,SHOES
815,B01MZE2BVO,"adidas Youth Soccer Messi 16+ Pureagility Firm Ground Cleats, 5.0 D(M) US, Blue / Running White / Black",Shoes,SHOES
816,B0158ZJXDQ,"adidas Messi 15.4 TF Turf Junior Soccer Cleats, Size 3",Shoes,SHOES
817,B06XFYJJ8Z,adidas Kids  Baby Boy's Field Goals Tee (Toddler/Little Kids) Adi Black 6,Apparel,SHIRT
818,B06XFTTZ3T,adidas Kids  Baby Boy's Sports Graphic Tee (Toddler/Little Kids) Marina Heather 7,Apparel,SHIRT
819,B074LBCLRW,Adidas EQT Support ADV Big Kids (GS) Shoes Core Black/Running White bb1295 (6 M US),Shoes,SHOES
820,B012P7UPXM,B24719 KIDS INFANT ZX FLUX MILLENIUM FALCON EL I ADIDAS CBLACK/REFLEC/FTWWHT,Shoes,SHOES
821,B076XCQ9N4,"Adidas Boys' Sport Tricot Jogger Set (Black/Red Rib, 7)",Apparel,SWEATER
822,B00OLTNAIA,"adidas Performance CC Fresh XJ Running Shoe,Purple/Berry/Tribe Purple,3 M US Little Kid",Shoes,SHOES
823,B073554CP3,Adidas AW17 Kanadia 8.1 Junior Trail Running Shoes - Blue/Orange - UK 5.5,Shoes,SHOES
824,B06XS6GBDW,Adidas Luc 5T backback 35LMUJI (current model) (College navy),Apparel,SPORTING_GOODS
825,B01MT45KWW,adidas Kids  Baby Boy's Field Tee (Toddler/Little Kids) White 2T Toddler,Apparel,SHIRT
826,B004SWNM3S,Adidas Mens Performance 1/2-Zip Training Top - BLACK - X-Large,Sports,OUTDOOR_RECREATION_PRODUCT
827,B01MA57WS3,Adidas D Lillard 2 J Youth US 6 Black Sneakers,Shoes,SHOES
828,B06XGPLVRR,Adidas Kids ACE 17+ PureControl FG Core Black/White/Blue Soccer Shoes - 4Y,Shoes,SHOES
829,B0779MCYXX,"adidas Short Sleeve Polo Shirt for Boys (Neon Green, Large (14-16))",Apparel,SHIRT
830,B00D0B5SUI,adidas Soccer Boots F10 TRX FG Messi Boys Cleats-Multi-12K,Shoes,SHOES
831,B01HQITVX0,"adidas Performance Kids' Copa 17.4 J Turf Soccer Cleat, Black/White/Black, 5 M US Big Kid",Shoes,SHOES
832,B06XCMLZ6T,ADIDAS KIDS UNISEX ORIGINALS STAN SMITH SHOES #BB3008 (7),Shoes,SHOES
833,B076C7N94M,"adidas Graphic-Print T-Shirt, Big Boy",Apparel,SHIRT
834,B00SJ3QVN0,Adidas Kids Pant Boys Tracksuit Woven 3 Stripe Pant Navy 7-14 Years New S22155 (7/8 Years),Apparel,SPORTING_GOODS
835,B01MYCOPVM,Adidas Tubular Instinct Youth US 6.5 Gray Tennis Shoe,Shoes,SHOES
836,B00WLUQUXS,2 PCS SET Adidas Little Boys Athletic T-Shirt & Dri-Fit Mesh Sport Shorts 05 Gree,Sports,SPORTING_GOODS
837,B075MS5L6T,"Adidas Boys 8-20 Short Sleeve Athletic Polo Shirt (Medium, Dark Grey Blue)",Apparel,SHIRT
838,B01HPGOYO4,ADIDAS KIDS ORIGINALS TUBULAR SHADOW SHOES #BY2223 (3 Little Kid M),Shoes,SHOES
839,B01I1JETQC,Adidas Boys T-shirts Football Manchester United FC Red Kids Tee Training AY6819 (128 - 8 Years),Apparel,SPORTING_GOODS
840,B074R9KHBN,Adidas Boy's Hoops Mid Lace Up Fashion Sneaker Blk/Yellow 13 M US,Shoes,SHOES
841,B01N6LBVF1,Boys adidas REVIGO 17 Long Sleeve GoalKeeper Jersey Junior For Soccer black/white,Sports,SPORTING_GOODS
842,B00YO2YDPS,Adidas Real Madrid Junior Tracksuit Childrens Presentation Woven New S87864 (13/14 Years 164cm),Sports,SPORTING_GOODS
843,B01N5TVOOE,"adidas Men's X 16+ Purechaos FG Soccer Cleats (Size 5.5) Blue, Shock Pink",Shoes,SHOES
844,B01MR14UVZ,adidas Kids Baby Boy's Undefeated Top (Toddler/Little Kids) Dark Blue Shirt,Sports,SPORTING_GOODS
845,B01N7MGCB7,adidas Kids Baby Boy's Dynamic Rise Printed Jogger (Toddler/Little Kids) Grey Pants,Sports,SPORTING_GOODS
846,B00D72JWC0,"Adidas Wrestling HVC Youth Laced Wrestling Shoe (Toddler/Little Kid/Big Kid),Black/White/Gum,1 M US Little Kid",Shoes,SHOES
847,B0731KY34D,Adidas Boy's ZX Flux J Sneakers (Big Kid),Shoes,SHOES
848,B0777SLF8K,"Adidas Boys' Sport Tricot Set (Bright Baby Blue, 7)",Sports,SPORTING_GOODS
849,B076QLGBC4,Adidas ZX Flux Youth Sneaker (5 M US Big Kid),Shoes,SHOES
850,B01A51GXUO,"adidas Big Boys' 3G Speed Short, Collegiate Navy/Solar Lime, Medium",Apparel,SHORTS
851,B00TYFIQGW,"adidas Baby Boys' Long Sleeve Tee and Pant Set, Light Scarlet Heather, 12 Months",Apparel,SHIRT
852,B01CGX3ADC,"adidas Boys Soccer Messi Woven Pants, Dark Grey/Solar Green, X-Large",Sports,SPORTING_GOODS
853,B01MPXR44C,Adidas Superstar Kids Shoes #S80147 (12),Shoes,SHOES
854,B019PKSV6U,adidas Kids Boy's D Rose 7 (Little Kid) Core Black/Ray Red/Footwear White Sneaker 3 Little Kid M,Shoes,SHOES
855,B00GODPE58,"Adidas Boys Hoodie Fleece Track set, Pants & Jacket (3T, Navy)",Apparel,SWEATER
856,B019QRPKJI,"adidas Performance Kids' Messi 16.3 Indoor Soccer Cleats, Shock Blue/Matte Silver/Black, 11.5 M US Little Kid",Shoes,SHOES
857,B01M1IB5E9,"adidas Performance Boys' Freak Mid Md j Football Shoe, Black/Metallic Silver/White, 4 Medium US Big Kid",Shoes,SHOES
858,B06XCQPFG2,Adidas Kids Superstar Bounce White 3.5,Shoes,SHOES
859,B0170FIZHW,Adidas Big Kids Star Wars Slip On Boot (black / core black / red) Size 6 US,Shoes,SHOES
860,B076HZHP8Z,Adidas Boy's Short Sleeve Athletic Polo Shirt Turqouise (Large (14/16)),Apparel,SHIRT
861,B01N9O0VX0,Adidas Boys Youth 8-20 Performance Logo Gray / Blue Active T-Shirt (Youth X-Large 18-20),Sports,SPORTING_GOODS
862,B015L49MUI,"adidas Golf Boys B Performance Polo Shirt, Navy, Medium",Sports,SHIRT
863,B00W6Y3QP4,"Adidas Little Boys' Multi Sport Tee, Grey Heather, 5",Apparel,SHIRT
864,B06XDBJ131,adidas Kid's ACE 17+ PURECONTROL FG J Soccer Cleats (Sz. 5) White Camo,Shoes,SHOES
865,B00M5K1QCY,Adidas Newborn Lil Fan 3 Piece Bodysuit Set - Texas A&M - 6/9,Sports,SPORTING_GOODS
866,B01N7PN8ZK,Golden State Warriors Youth High Density Long Sleeve Blue T Shirt Boys 8-20 (Youth Large 14-16),Apparel,SHIRT
867,B01IWDWL4Y,"adidas Kids' Jr Adipower Boa Dksimt/Ft Skate Shoe, Dark Silver, 3 M US Little Kid",Shoes,SHOES
868,B076DMZJWL,"adidas Kid's Messi NEMEZIZ 17+ 360 Agility FG Soccer Cleats, 5.0 D(M) US, Running White Ftw / Warning / Clear",Shoes,SHOES
869,B015L48ZX8,"adidas Golf Boys B Climacool 3-Stripes Polo Shirt, Black/White, X-Large",Sports,SHIRT
870,B00HSF0ERY,"adidas Performance NXT LVL SPD Next Level Speed 2 K Mid-Cut Basketball Shoe (Little Kid/Big Kid), Light Onix/Collegiate Navy/Aluminum 2, 12 M US Little Kid",Shoes,SHOES
871,B01MY2HRSR,adidas Kids Baby Boy's Print Logo Tee (Toddler/Little Kids) Dark Grey Heather T-Shirt,Sports,SPORTING_GOODS
872,B073TSZ541,Adidas Crazy 8 Boy's Gradeschool Shoes Size 7,Shoes,SHOES
873,B01MTA273U,adidas by Mini Rodini Stan Smith PK MR I Core Black/Off White BY2092 (SIZE: 9K),Shoes,SHOES
874,B01CGX07TC,"Boy's Adidas Soccer Boy's Urban Football Training Pant, Black/Black, X-Large",Sports,SPORTING_GOODS
875,B01N1MU72X,Adidas ZX Flux Primeknit (Kids),Shoes,SHOES
876,B01N5MJMG1,"Adidas Boys' Mach One Tee B 88oj5 Qv, Dark Grey/Eqt Yellow, Small",Apparel,SHIRT
877,B01BW33KBY,adidas Kids Boy's Cross Up 3/4 Pants (Little Kids/Big Kids) Light Grey Heather Solid Grey Pants,Sports,SPORTING_GOODS
878,B01BKPZOI6,"Adidas Youth Big Boys Short Sleeve Climalite Train Dominate Repeat Tee (X-Large (18), Orange)",Apparel,SHIRT
879,B06XCK42DY,ADIDAS STAN SMITH C KIDS SHOES #BB0213 (3),Shoes,SHOES
880,B071K61WSH,Adidas ZX Flux J BY9833 Kids shoes size: 7 US,Shoes,SHOES
881,B010Q3ODYE,"adidas Performance J Wall 2 Boost J Shoe (Big Kid),Dark Purple/Blast Purple/Shock Pink,4.5 M US Big Kid",Shoes,SHOES
882,B07798WN3K,Boys adidas ADIPRO 18 JUNIOR GoalKeeper Jersey Long Sleeve dark grey/unity pink/white For Soccer,Sports,SHIRT
883,B06XSS3KHY,"Adidas Toddler Boys' Basketball Short Set, Dark Blue, 4T",Apparel,SWEATER
884,B019PKEN8A,Adidas Cloudfoam Ilation Mid K Youth US 10.5 Black Basketball Shoe,Shoes,SHOES
885,B010S0LBAY,"adidas Performance Boys Club Tee, White, Large",Sports,SPORTING_GOODS
886,B0742PBNN6,"Adidas Youth Boys Athletic Muscle Tank, Neon Yellow (Small (8))",Apparel,SHIRT
887,B06X93WXHD,Adidas Boys 8-20 Youth Ultimate Tee Core Navy Climalite T-Shirt (Youth Medium 10-12),Sports,SPORTING_GOODS
888,B01ICB6Y4Y,"Adidas Youth Big Boys Elevated Tech Hoodie, Yellow",Apparel,SWEATER
889,B00ZZ3J9T0,"adidas Ace 15.4 FxG Junior / Kids Flexible Ground Soccer Cleats, Size 5.5",Shoes,SHOES
890,B01FOJDJ6I,adidas Top Ten Hi J,Shoes,SHOES
891,B019NOAOCC,"adidas Big Boys Jamfest Short, Black/White, Medium",Apparel,SHORTS
892,B01FMAKASE,2016-2017 Bayern Munich Adidas Home Little Boys Mini Kit,Sports,SPORTING_GOODS
893,B06XT5SM1P,"Adidas Youth, Big Boys, Climalite 3 Stripe Side Panel Lightweight Pant",Apparel,PANTS
894,B06XCXH3HT,adidas Kids ACE 17.1 FG Red/White/Core Black Shoes - 4Y,Shoes,SHOES
895,B01MS2FWC2,adidas Kids  Baby Boy's Speed & Power Tee (Toddler/Little Kids) Gold 4  US Little Kid,Apparel,SHIRT
896,B0195LPDN8,"adidas Performance Boys' Adiease J Sneaker, Black/Solid Grey, 5 M US Big Kid",Shoes,SHOES
897,B071P3XCJ6,"adidas JR X 16.1 FG Solar Green Soccer Cleats, Size 5",Shoes,SHOES
898,B0736FJFYV,Adidas Top Ten Hi J Big Kids Style: F37290-CROYAL/BLROCO Size: 6.5,Shoes,SHOES
899,B01DOF0CYQ,Kansas Jayhawks Basketball Youth Adidas On Court Climalite Shirt (Large),Sports,SPORTING_GOODS
900,B0722NZCP9,adidas Kids Baby Boy's Linear Tee (Toddler/Little Kids) Turquoise 2T Toddler,Apparel,SHIRT
901,B06X1G66SS,adidas Kids Running Shoes AltaRun Cloudfoam Unisex Training School BA9422 (EU 33.5 - UK 1.5 - US 2),Shoes,SPORTING_GOODS
902,B0058XEKU0,Adidas Condivo Youth Training Jacket (Blue) SIZE YM,Shoes,SHOES
903,B07193PLJY,"Adidas Athletic Track Pant for Boys (Large / 14/16, Black/White)",Apparel,PANTS
904,B076XR74ST,"Adidas Boys' Sport Tricot Jogger Set (Black/Red Rib, 3T)",Apparel,SWEATER
905,B00W6Y86FO,"adidas Toddler Boys' Active Two-fer Tee Shirt, Light Scarlet, 2T",Apparel,SHIRT
906,B01LX3DDOB,Adidas J Wall 2 J Youth US 6.5 Blue Basketball Shoe,Shoes,SHOES
907,B06XXLYPMP,adidas Kid's ACE 17+ PURECONTROL FG J Soccer Cleats (Sz. 5.5) Solar Green,Shoes,SHOES
908,B0185VJNTE,adidas Condivo 16 Training Skinny Pants (Youth) - Navy/Blue - Age 13-14,Sports,SPORTING_GOODS
909,B01AVKYIMO,Adidas Boys Active Wear 2 Piece Athletic Outfit Set Navy/Royal (Hooded)) (2T),Sports,SPORTING_GOODS
910,B01GPLGHJU,Adidas Boy's Star Wars K White/Black/Grey BB0920 (5.5 Big Kid M),Shoes,SHOES
911,B019QTF01O,"adidas Performance Boys' s-Flex k Running Shoe, Collegiate Navy/Ray Red/White, 11 M US Little Kid",Shoes,SHOES
912,B071SLQ6JT,"Boy's adidas Boys Youth Originals Trefoil Chain, Collegiate Navy/White, One Size",Sports,SPORTING_GOODS
913,B004FU3U94,adidas Core 11 Rain Jacket (Black/White) Size XL,Sports,SPORTING_GOODS
914,B01MYDSQX0,"adidas Kids' Messi 16.1 FG Soccer Cleats, Size 4",Shoes,SHOES
915,B00ATGD3PY,Adidas Originalsrain K Youth US 11 Black Rain Boot,Shoes,SHOES
916,B017S6UCN8,"Adidas Boy's Long Sleeve Thermal Shirt, 8-20 (Medium (10/12), Navy)",Sports,SPORTING_GOODS
917,B00UIY5QUC,Adidas J Wall 1 (Woven Paisley) Grey/White (5.5),Shoes,SHOES
918,B01N5KG7HW,adidas Kids Boy's Midfielder Shorts (Big Kids) Navy/Yellow Shorts,Sports,SPORTING_GOODS
919,B072DVZ253,Adidas Climacool 1 J Original Running Shoe White / White / White…,Shoes,SHOES
920,B01N8TP313,"Michigan Wolverines NCAA Infants Short Sleeve Football Creeper, Brown (Brown, 12 Months)",Sports,SPORTING_GOODS
921,B01EWP05F8,"adidas Big Boys' Performance Short Sleeve Tee, Unity Orange/MGH Solid, Medium/10-12",Apparel,SHIRT
922,B010NNMQBE,"adidas Performance Kanadia 7 TR K Trail Running Shoe ,Power Red/Orange/Vivid Red,11 M US Little Kid",Shoes,SHOES
923,B01D0TVRAY,"adidas Performance Kids' Ace 16.3 Primemesh Indoor Soccer Shoe (Little Kid/Big Kid), White/Black/Metallic Gold, 10.5 M US Little Kid",Shoes,SHOES
924,B010Q3TL7S,"adidas Performance NXT LVL SPD IV K Shoe (Little Kid/Big Kid),Clear Green/Mineral Blue/Vivid Red,10.5 M US Little Kid",Shoes,SHOES
925,B073WZWG2S,Adidas Pharrell Williams PW Tennis hu Big Kids Shoes White/Green ba7828 (7 M US),Shoes,SHOES
926,B074W6FQTH,Adidas Originals Shoes - Adidas Originals Pharr...,Shoes,SHOES
927,B06XZXB9PY,adidas ZX Flux,Shoes,SHOES
928,B0777RP745,"Adidas Boys' Sport Tricot Set (Bright Baby Blue, 4T)",Sports,SPORTING_GOODS
929,B0779DCPMZ,Boys adidas ADIPRO 18 JUNIOR GoalKeeper Jersey Long Sleeve bold aqua/unity blue/energy aqua For Soccer,Sports,SHIRT
930,B010XB6F68,"adidas Performance Snice 4 CF I Infant Shoe (Toddler), Black/Black/White, 4 M US Toddler",Shoes,SHOES
931,B010Q1K9US,"adidas Performance X 15.3 FGAG J Soccer Shoe (Little Kid/Big Kid),White/Black/Semi Solar Slime,4.5 M US Big Kid",Shoes,SHOES
932,B01ATWEMF2,Adidas Boys Orange Shirt (Medium / 10-12 Big Kids),Sports,SPORTING_GOODS
933,B01M1IC1Z6,"adidas Performance Boys' Alphabounce Em j Running Shoe, Tech Earth/Bliss/Crystal White, 4 M US Big Kid",Shoes,SHOES
934,B00J2GSXFM,Adidas Youth Estro 12 Jersey Big Kids Style: X40645-MAROON Size: XL,Sports,SHOES
935,B076B7QVFM,"Adidas Baby Boys' 2-Piece Tricot Tracksuit - black/red, 12 months",Apparel,SWEATER
936,B06XH6Y88D,Adidas Kids Messi 16.3 Turf Soccer Shoes Red/Core Black/White Soccer Shoes - 11.5K,Shoes,SHOES
937,B010FMOV4S,adidas Superstar Foundation Cf I Kids Trainers White Pink - K9 UK,Shoes,SHOES
938,B071VJP19K,adidas Tubular Shadow Knit J #BY8812,Shoes,SHOES
939,B075HGT2HZ,ADIDAS AlphaBounce J Star Wars Shoes BW1117 (6.5 Big Kids US),Shoes,SHOES
940,B074KQJHBC,Adidas Spring Blade J Kid's Shoes Size 4.5,Shoes,SHOES
941,B0744RSZ5X,Adidas Jr Messi 16.3 FG Red/CBlack/FtwWht Shoes - 13.5K,Shoes,SHOES
942,B072R49RHT,Adidas Originals Skate Shoes - Adidas Originals...,Shoes,SHOES
943,B072R33PRQ,Adidas Originals Trainers - Adidas Originals Sw...,Shoes,SHOES
944,B072R15W5F,Adidas Originals Shoes - Adidas Originals Tubul...,Shoes,SHOES
945,B071WD49NJ,Adidas Originals Shoes - Adidas Originals Seele...,Shoes,SHOES
946,B071K9918H,Adidas Originals Shoes - Adidas Originals Adi-e...,Shoes,SHOES
947,B06W56ZTPP,Adidas Originals Trainers - Adidas Originals Su...,Shoes,SHOES
948,B01HQTHW3K,"adidas Originals Boys' Eqt Support Adv Snake I Sneaker, Chalk White/Chalk/White, 5.5 M US Toddler",Shoes,SHOES
949,B01N5DGPTX,"Adidas Big Boys' Smoke Screen Training Top, Caviar Black, XL",Apparel,SHIRT
950,B0163GDCKY,"adidas Originals Samoa I Sneaker (Toddler), Shock Blue/Shadow Blue/Metallic Gold, 4 M US Toddler",Shoes,SHOES
951,B06WGQ4RS7,Adidas Boys 8-20 Charcoal / Orange Climalite Logo Performance T-Shirt (Youth Small 8),Sports,SPORTING_GOODS
952,B01LQR29A4,"adidas Performance Boys' Superstar CF I Sneaker, White/White/Black, 5.5 M US Toddler",Shoes,SHOES
953,B06XDHP6KS,Adidas Kids ACE 17.1 FG Red/White/Core Black Soccer Shoes - 4.5Y,Shoes,SHOES
954,B010Q1L1R8,"adidas Originals Superstar CTXM J Shoe (Big Kid), Yellow/White/Black, 6.5 M US Big Kid",Shoes,SHOES
955,B00UYB9920,Adidas - F5 - M17673 (12.5 Kids),Shoes,SHOES
956,B01N7GAMLI,"adidas Toddler Boys' Compete Tee, Neon Green, 2T",Apparel,SHIRT
957,B01IF3QPGQ,"adidas Originals Boys' Superstar J Sneaker, Black/Black/Black, 3.5 M US Big Kid",Shoes,SHOES
958,B071JZWQZX,adidas Youth Press Coverage Football Pant S Collegiate Navy-White,Apparel,PANTS
959,B07848LRJ1,"adidas Boys' Triple Stripe Performance Hoodie(Blue Surf, L)",Sports,SPORTING_GOODS
960,B0783P4SB8,"Adidas Boys' Badge of Sport T-Shirt (Navy, M)",Sports,SPORTING_GOODS
961,B0783NSLT1,"Adidas Boys' Triple Stripe Baseball Jacket (Red Tango, L)",Sports,SPORTING_GOODS
962,B0783NR35S,"Adidas Boys' Pattern Fill Logo T-Shirt (Collegiate Navy, XL)",Sports,SPORTING_GOODS
963,B077L1W8NL,"Adidas Boys' Influencer Shorts (Blue, XL)",Sports,SPORTING_GOODS
964,B077KZZNBT,"Adidas Youth Baseball Belt (Black, Youth)",Sports,SPORTING_GOODS
965,B000KGORY4,"adidas Baby Boys' Tricot Zip Up Jacket and Pant Set, Onix, 3 Months",Apparel,PANTS
966,B01NCI3LI2,"adidas NEO Boys' BB9TIS Mid K Sneaker, Black/Scarlet/Grey Four, 2.5 Medium US Little Kid",Shoes,SHOES
967,B01MS0ARF5,"adidas Boys' Nemeziz 17.3 FG J Soccer Shoe, Solar Orange/Black/Black, 4 Medium US Little Kid",Shoes,SHOES
968,B06XGQ7X74,adidas Kids  Boy's Base Layer Full Length Tights (Big Kids) Black Pants,Sports,SPORTING_GOODS
969,B0767444B6,adidas Originals Girls' 3-Stripes Trefoil T-Shirt,Sports,SPORTING_GOODS
970,B071RRQBL9,adidas Kids  Boy's Fusion Pullover (Big Kids) Black Heather X-Large,Sports,SPORTING_GOODS
971,B01MRVI4EI,"adidas Big Boys' Active Tee Shirt, Dark Blue, XL",Apparel,SHIRT
972,B01HOX6GIU,"Adidas Big Boys Youth Designator Pants, Grey",Sports,SPORTING_GOODS
973,B01N6LTQL2,adidas Kids  Baby Boy's Smokescreen Training Top (Toddler/Little Kids) Navy 4  US Little Kid,Sports,SPORTING_GOODS
974,B06XFQY6RL,adidas Kids Boy's Logo Sport Ball Tee (Big Kids) Marina Heather Large,Sports,SPORTING_GOODS
975,B01I36A80E,adidas Originals Kids Boy's Linear Overlay (Little Kids/Big Kids) Black X-Large,Sports,SPORTING_GOODS
976,B06XGQ7GC9,adidas Kids  Boy's Long Sleeve Base Layer Top (Big Kids) Black Shirt,Sports,SPORTING_GOODS
977,B010Q3MJTU,"adidas Performance First Step K Shoe (Little Kid/Big Kid),Blue Glow/Green Glow/Super Blush,10.5 M US Little Kid",Shoes,SHOES
978,B019YDUMTW,"Adidas MC-X I Boys Sneakers Size US 1, Regular Width, Color Black/Gold",Shoes,SHOES
979,B01A1HMTOQ,"adidas Performance Boys' BB9TIS Mid K Sneaker, Black/Infrared/White, 7 M US Big Kid",Shoes,SHOES
980,B010XASIYQ,"adidas Performance D Rose 6 I Shoe (Infant/Toddler), Scarlet/White/Black, 10 M US Toddler",Shoes,SHOES
981,B01N0VUFA1,adidas Kids  Baby Boy's Dominate Tee (Toddler/Little Kids) Black Heather 7,Apparel,SHIRT
982,B01LY4CTDO,Adidas Tubular Radial (Kids),Shoes,SHOES
983,B00LT0ZC1C,"Adidas Youth Designator Fleece Pants (Youth Medium, Onyx Grey/ White)",Apparel,PANTS
984,B01HHCZJEK,"adidas Performance Boys' Fortarun K Wide Running Shoe, Black/Energy/Metallic/Silver, 10.5 W US Little Kid",Shoes,SHOES
985,B0712525WW,Adidas NEMEZIZ 17+ 360AGILITY Youth Firm Ground Cleats [FTWWHT] (4.5),Shoes,SHOES
986,B01EWOW4PI,"adidas Boys' Big Boys' Designator Pant, Collegiate Royal/Green, X-Large/18",Apparel,PANTS
987,B01N7GAOWK,"Adidas Toddler Boys' Team Training Pant, Black/Blue, 2T",Apparel,PANTS
988,B01A1HNAKI,"adidas NEO BB9TIS K Basketball Shoe (Little Kid/Big Kid) (7 M US Big Kid, Collegiate Navy/White/Satellite)",Shoes,SHOES
989,B00O0D76BY,"Adidas Springblade Razor Boys Running Shoes Size US 4, Regular Width, Color Grey/Orange",Shoes,SHOES
990,B01MRKFQS7,"adidas Junior Howzat Full Spike Cricket Shoes, White, US6.5",Shoes,SHOES
991,B01ABG4K8K,"adidas Toddler Boys' Active Raglan Tee Shirt, Black Heather, 3T",Apparel,SHIRT
992,B00HG0BR0O,"adidas Performance Powerblaze Running Shoe (Little Kid/Big Kid), Core Black/Silver/Solar Red, 13 M US Little Kid",Shoes,SHOES
993,B06XFY2J2L,adidas Kids  Boy's Logo Skins Tee (Big Kids) Adi Black Heather Medium,Apparel,SHIRT
994,B01NAH9R5X,"Adidas Big Boys' Baselayer Short, Caviar Black, M",Apparel,SHORTS
995,B01BPL6HF4,Adidas Combat Speed 4 Youth Wrestling Shoes - 3 - White/Navy,Shoes,SHOES
996,B017KT2DU8,"Adidas Boys Tech Fleece Climawarm Full Zip Hoodie (Medium, Navy/Yellow)",Apparel,SWEATER
997,B017DV5IIM,Adidas® Youth Core Pant-Bright Royal Blue/Orange Small (8),Sports,PANTS
998,B00CV54T1I,Adidas Infants Dragon CF I,Shoes,SHOES
999,B06XFZLTCM,adidas Kids  Baby Boy's Logo Skins Tee (Toddler/Little Kids) Collegiate Navy Heather 4  US Little Kid,Apparel,SHIRT
