,ASIN,Title,ProductGroup,ProductTypeName
502,B01NGUFVO6,"adidas Big Boys' Triple up Performance Short, Red, XL",Apparel,SHORTS
503,B06XSP6PSF,"Adidas Boys Youth Mesh On Field Athletic Shorts, Black",Apparel,SHORTS
504,B019HDJ4A2,adidas Kids Unisex Messi Pants (Little Kids/Big Kids) Black/White/Shock Blue MD (10-12 Big Kids) X One Size,Sports,SPORTING_GOODS
505,B01FGEXQDW,Adidas TUBULAR X K boys fashion-sneakers S78719_3 - Solid Magenta/Shock Pink/White,Shoes,SHOES
506,B01MR2ZN6Z,Adidas Boys Youth 8-20 EQT Yellow / Black Climalite Performance Logo T-Shirt (Youth Medium 10-12),Sports,SPORTING_GOODS
507,B0767MJZXL,Adidas Kids PW TENNIS HU J 3.5,Shoes,SHOES
508,B0766676R5,"Adidas Athletic Basketball Shorts for Boys (Medium - 10/12, Navy Blue/Green)",Sports,SPORTING_GOODS
509,B01N5DGRE1,"Adidas Big Boys' Performance Tee Shirt, Red, L",Apparel,SHIRT
510,B01HIPULL2,"adidas Performance Boys' Cross 'Em up 2016 Skate Shoe, Light Onix/Black/Light Scarlet, 6 M US Big Kid",Shoes,SHOES
511,B01JZXAHLE,"adidas Golf Boys 3 Stripe Chest Polo, Mid Grey, X-Large",Sports,SPORTING_GOODS
512,B01LZSRZLI,Adidas Youth Superstar Black Gold Leather Trainers 6 US,Shoes,SHOES
513,B00DWGTTZ6,"adidas Performance Change Up MD 2 K Baseball/Softball Cleat (Little Kid/Big Kid), Black/University Red/White, 5 M US Big Kid",Shoes,SHOES
514,B01NCE0AYD,"adidas Performance Boys' Rapidarun K Wide Running Shoe, Grey/Grey/Semi Solar Yellow, 13 W US Little Kid",Shoes,SHOES
515,B071RRQ917,adidas Kids  Boy's Fusion Pullover (Big Kids) Black Heather Small,Apparel,SHIRT
516,B01MXFS27A,"adidas Performance Boys' Crazy Time I Sneaker, White/Black/Light Scarlet, 5 M US Toddler",Shoes,SHOES
517,B0784DJYXB,Adidas D Rose Baskteball Kid's Shoes Size 4.5,Shoes,SHOES
518,B01M16KN1H,"adidas Unisex-Kids Adizero 5-Star 6.0 j Baseball Shoe, White/White, 4 M US Big Kid",Shoes,SHOES
519,B0197DAJE2,Adidas Response Boost Techfit Running Kid's Shoes Size 6.5,Shoes,SHOES
520,B073X4MCBH,Adidas NEMEZIZ 17.1 Youth Firm Ground Cleats [FTWWHT] (11K),Shoes,SHOES
521,B01N2KISLK,"adidas Boys Tennis Court Tee, Scarlet/White/Black, Medium",Sports,SPORTING_GOODS
522,B01MSVTBJP,"adidas NEO Boys' Lite Racer K Sneaker, White/White/White, 6 Medium US Little Kid",Shoes,SHOES
523,B01N1QEHCV,"adidas Toddler Boys' Active Tee Shirt, Navy Heather, 4",Apparel,SHIRT
524,B01N6LWKTM,adidas Kids Boy's Dynamic Rise Jogger (Big Kids) Navy Pants,Sports,SPORTING_GOODS
525,B076H5YHLT,Adidas Superstar J White/Copper/White (Big Kid) (5 M US Big Kid),Shoes,SHOES
526,B009SOUL8U,Adidas 3 Stripes Youth Performance Black / White Active Track Pants,Sports,SPORTING_GOODS
527,B072Q7RM66,Adidas Unisex Superstar CTXM J Black White Shoes (7 M US Big Kid),Shoes,SHOES
528,B06XFTTZ3Y,adidas Kids  Boy's Short Sleeve Helmet Tee (Big Kids) Collegiate Navy Large,Sports,SPORTING_GOODS
529,B074T3ZVX2,"Adidas Boys' Zone Tricot Jacket and Pant Set (5, Electric Orange)",Sports,SPORTING_GOODS
530,B01N1X5PJJ,adidas Youth Boys' Ultimate Short-Sleeved Performance T-Shirt (Green Youth Medium 10-12),Sports,SPORTING_GOODS
531,B019QRPU5C,"adidas Performance Kids' Messi 16.3 Firm Ground Soccer Cleats, Shock Blue/Matte Silver/Black, 3 M US Little Kid",Shoes,SHOES
532,B0764GC7CP,adidas Boys' Impact Tricot Jogger Pants,Sports,OUTDOOR_RECREATION_PRODUCT
533,B0748MNMQ9,"Adidas Boys Tech Fleece Logo Hoodie (Large, Black/Scarlet)",Apparel,SWEATER
534,B073X5Y1ZL,adidas Kids Basketball Youth Harden Vol.1 Shoes #BW0630 (6.5 M US Big Kid),Shoes,SHOES
535,B01N6EWEWU,"Adidas Big Boys' Hustle Harder Tee, Medium Blue, M",Apparel,SHIRT
536,B01GQ5DZ1I,"adidas Performance Boys' Hyperfast 2.0 Cf i Sneaker, Black/Metallic Silver/Semi Solar Green, 8.5 M US Toddler",Shoes,SHOES
537,B019HDQI24,"adidas Originals Boys' Trefoil Tee, White Trefoil, X-Small",Apparel,SHIRT
538,B01LSWUOZ4,adidas Kids Boy's All-Star Replica Soccer Jersey (Little Kids/Big Kids) Masblue/Red Small,Sports,SPORTING_GOODS
539,B010Q3S62E,"adidas Performance Light Em Up 2 C Shoe (Little Kid),Light Onix Grey Grey/Scarlet/Black,11 M US Little Kid",Shoes,SHOES
540,B011SH1YTO,Adidas Boys 8-20 Youth Charcoal / Shock Red Climalite Performance T-Shirt (X-Large / 18 Big Kids),Sports,SPORTING_GOODS
541,B01MY3D5N0,adidas Kids Boy's Smokescreen Shorts (Big Kids) Black/Blue Shorts,Sports,SPORTING_GOODS
542,B072F8J3BQ,"Adidas Youth Boys Layup 3-Stripe Track Pant (Large (14/16), Navy/Yellow)",Apparel,PANTS
543,B0046XSL7Q,"adidas Performance Adilight SC XJ Slide Sandal (Little Kid/Big Kid),Black/Silver/Clear Grey,6 M US Big Kid",Shoes,SHOES
544,B01HIO4WLI,adidas Kids Boy's Turf Trainer (Little Kid/Big Kid) Solar Green/Black/Green 11 Little Kid M,Shoes,SHOES
545,B00N1B7L20,Adidas Big Girls Ultimate Pullover Performance Logo Hoodie,Sports,SPORTING_GOODS
546,B071DTHPTP,adidas Kids Boy's Clima Future Stripe Logo Tee (Big Kids) Bright Blue T-Shirt,Sports,SPORTING_GOODS
547,B00R8NMD5M,"adidas Performance X 15.4 FG J Soccer Shoe (Little Kid/Big Kid), Solar Yellow/Solar Yellow/Black, 2 M US Little Kid",Shoes,SHOES
548,B06XS22HQT,adidas Kids Unisex Originals Superstar Shoes (2 Little Kid M),Shoes,SHOES
549,B01H035PF4,"adidas Baby Boys' Zip Hoodie and Pant Set, Blue, 18 Months",Apparel,PANTS
550,B07149GPQ3,"Adidas Big Boys' Active Tee Shirt, Black, XL",Apparel,SHIRT
551,B073QWQ5T5,Adidas Kid's Stan Smith Pastel TACROS/TACROS/RAWPIN 5.5,Shoes,SHOES
552,B011AEIESY,"adidas NEO Cloudfoam Ilation Mid K Kids Casual Footwear (Little Kid/Big Kid),Black/Metallic Silver/White,2 M US Little Kid",Shoes,SHOES
553,B0711SZ49T,adidas Kids  Baby Boy's Clima Performance Logo Tee (Toddler) Navy T-Shirt,Sports,SPORTING_GOODS
554,B01N1P0ZSB,"adidas Neo Boys' CF Refresh Mid K Sneaker,GREONE/FTW/GRETHR,3.5 M US LK",Shoes,SHOES
555,B072L8295T,"Adidas Big Boys' Tricot Pant, Black Scarlet, L",Apparel,PANTS
556,B075JL75B9,Adidas Rockadia Running Shoes - Dkgrey/Ftwwht/Shkmin - Boys - 4.5,Shoes,SHOES
557,B06XT8S5LW,"Adidas Toddler Boys' Smoke Screen Jacket Set, Navy, 4T",Apparel,SWEATER
558,B06XGRRTCC,"Adidas Big Boys' Fleece Striker Pant Youth, Black/Blue, L(14/16)",Apparel,PANTS
559,B01MT1ACIT,"adidas Boy's Youth Sport Performance Climalite 2 Pack Boxer Brief Underwear, Onix/Solar Blue, Large",Sports,SPORTING_GOODS
560,B01M0J5H7T,"adidas Originals Unisex-Kids Pro Model C Sneaker, Ftwr White, Black, Metallic/Gold, 2 M US Little Kid",Shoes,SHOES
561,B001PBEP1S,"adidas Toddler Boys' Tricot Pant, Black, 2T",Apparel,PANTS
562,B075VBZ31J,Adidas Kids Ultraboost 5.5,Shoes,SHOES
563,B071S24T2D,"Adidas Toddler Boys' Striker Soccer Pant, Grey Heather Body Solar Yellow, 2T",Apparel,PANTS
564,B06XGQCBM4,"Adidas Little Boys' Focus Jogger, Black, 7",Apparel,PANTS
565,B06XGQVXQJ,adidas Kids  Boy's Iconic Tricot Jogger Pants (Big Kids) Adi Black MD (10-12 Big Kids),Sports,SPORTING_GOODS
566,B06XX5WNNS,"adidas NEO Boys' VS Switch 2 K Sneaker, Black/White/Grey, 2 M US Little Kid",Shoes,SHOES
567,B075FG923V,"Adidas Big Boys' Quarter Zip Pullover, Black, L(14/16)",Apparel,SHIRT
568,B06XGN94W1,"Adidas Little Boys' Fleece Striker Pant Child, Black/Blue, 6",Apparel,PANTS
569,B01N9KIZRT,"adidas Performance Boys' Nemeziz Messi Tango 17.3 TF J, White/Legend Ink/Energy Blue, 12 Medium US Little Kid",Shoes,SHOES
570,B01HSLF9UO,"adidas NEO Boys' BB9TIS Mid Inf Sneaker, Onix/Warning/Tech Grey, 6 M US Toddler",Shoes,SHOES
571,B06XTW8FNG,Adidas Vertical Logo Youth Big Boys Athletic T-Shirt,Apparel,SHIRT
572,B01A7LJ7IM,"Adidas Boys Active Wear 2 Piece Athletic Outfit Set (4T, Dark Blue/Orange)",Sports,SPORTING_GOODS
573,B0017JGX40,"adidas Adissage Sandal (Toddler/Little Kid/Big Kid),Black/White/Black,12 M US Little Kid",Shoes,SHOES
574,B01M7PSR0Q,"Adidas Youth Big Boys Game Time Hoodie And Pants Set, Dk Grey/ Green",Sports,SPORTING_GOODS
575,B07842FB92,Adidas Gazelle 2 Big Kids Style: BA9318-Off Wht Size: 4 Y US,Shoes,SHOES
576,B01MXUWM9G,"adidas NEO Girls' Racer TR Inf Sneaker,Utility Black/Black/White,10 Medium US Toddler",Shoes,SHOES
577,B000OAMW1G,"adidas Performance Kids' Samba M K Indoor Soccer Cleat (Little Kid/Big Kid),Black/White,13.5 M US Little Kid",Shoes,SHOES
578,B06XSB5XHM,"adidas Originals Boys' X_PLR C, Core Black/Core Black/Core Black, 2 M US Little Kid",Shoes,SHOES
579,B01N9EAIHD,"adidas NEO Boys' CF Race K Sneaker, Grey Three/Solar Red/Grey Five, 5 Medium US Little Kid",Shoes,SHOES
580,B00RBZI7AW,"adidas Performance S-Flex K Running Shoe,Semi Night Flash/Purple/Midnight Indigo/Blue/Yellow,10.5 M US Little Kid",Shoes,SHOES
581,B01J97DJH0,"adidas Youth Cushioned 6pk Low Cut Sock, Black/Black-Onyx Marl/Light Onyx/Onyx, Large",Sports,SPORTING_GOODS
582,B01N0NJGWJ,"adidas NEO Boys' BB9TIS Mid K Sneaker, Black/Scarlet/Grey Four, 7 Medium US Little Kid",Shoes,SHOES
583,B077KRLT3Y,"Adidas Boys' Designator Track Pants (Black/White, M)",Sports,SPORTING_GOODS
584,B0773XC96S,Boys 8-20 adidas Iconic Track Jacket (MEDIUM),Apparel,OUTERWEAR
585,B01MY15AY8,"adidas Performance Boys' Ace 17.3 FG J, Solar Orange/Black/Solar Red, 11.5 Medium US Little Kid",Shoes,SHOES
586,B000QXGTWE,"adidas Performance Samba M I Leather Indoor Soccer Shoe (Infant/Toddler),Black/White,8 M US Toddler",Shoes,SHOES
587,B00OANDXBQ,"adidas Performance Men's Galaxy Elite M Running Shoe,Collegiate Navy/Silver/Light Grey,11 M US",Shoes,SHOES
588,B01N0TRE4L,"adidas Boys' Nemeziz 17.4 Fxg J Soccer Shoe, Legend Ink/Solar Yellow/Energy Blue, 12.5 Medium US Little Kid",Shoes,SHOES
589,B01MU3F1F5,"adidas Boys' Cross 'Em up Basketball Shoe, Black/Black, 4 Wide US Little Kid",Shoes,SHOES
590,B01CT6YZNK,"adidas NEO Boys' Cloudfoam Race K Running Shoe, Black/White/Tech Grey, 6.5 M US Big Kid",Shoes,SHOES
591,B01EWOYXJI,"adidas Big Boys' Active Hoodie, Light Scarlet/Black, Large/14-16",Apparel,SWEATER
592,B075TJNQYJ,"adidas Kid's X 17+ Purespeed FG Soccer Cleats, 6.0 D(M) US, Core Black / Solar Red / Solar Orange",Shoes,SHOES
593,B01M3UM5V7,Adidas Youths Gazelle 2.0 Red Suede Trainers 6 US,Shoes,SHOES
594,B074P4FD9T,adidas Kids Unisex RapidaRun Lux C (Little Kid) Clear Onix/Grey/White 2 M US Little Kid,Shoes,SHOES
595,B01N5C35BY,"adidas NEO Boys' CF Refresh Mid K Sneaker,Black/White/Grey Five,5.5 Medium US Little Kid",Shoes,SHOES
596,B0765NZVQP,"adidas Track Training Pants for Boys (Small / 8, Black/White)",Apparel,PANTS
597,B01CT7J8NG,"adidas Boys' Raleigh Mid K Sneaker, Clear Onix/Light Onix/White, 7 M US Big Kid",Shoes,SHOES
598,B06XGN6GJG,"Adidas Toddler Boys' Fleece Striker Pant Child, Navy/Green, 3T",Apparel,PANTS
599,B06XSQ1QJV,"adidas Toddler Boys' Defender Short Set, Silver Heather, 4T",Apparel,SWEATER
600,B01MXW9LQM,"Adidas Little Boys' Active Tee Shirt, Medium Orange, 7",Apparel,SHIRT
601,B01MTYPT6D,"Adidas Little Boys' Active Tee Shirt, Turquoise, 7",Apparel,SHIRT
602,B0749C8X1X,adidas Dame 3 Shoe Junior's Basketball 5 White-Core Black-Onix,Shoes,SHOES
603,B01MZYTIAB,"adidas Performance Boys' X 17.4 in J Soccer Shoe, White/Energy Blue/Clear Grey, 12 Medium US Little Kid",Shoes,SHOES
604,B077B7DBT6,"Adidas Boys CrazyLight Boost Low 2016 Basketball Shoes (4 Big Kid M, White/Collegiate Navy/Scarlet)",Shoes,SHOES
605,B072HN8JG4,"Adidas Little Boys' Tricot Pant, Black Body Blue, 5",Apparel,PANTS
606,B01HQITKJK,"adidas Performance Boys' Copa 17.4 in J Skate Shoe, Black/White/Black, 5.5 M US Big Kid",Shoes,SHOES
607,B06XTMRMHP,"Adidas Little Boys' Clima Perfomance Logo Tee, Navy, 7X",Apparel,SHIRT
608,B01HG7R83Q,"adidas Boys Tennis Club Tee, White, Large",Sports,SPORTING_GOODS
609,B01MTU4S3G,"adidas Boys' X 17.4 Fxg J Soccer Shoe, Solar Yellow/Legend Ink/Legend Ink, 4.5 Medium US Little Kid",Shoes,SHOES
610,B019PN65RY,"adidas Performance Boys' Cross 'Em up 2016 Basketball Shoe, Black/Metallic Silver/Light Onix, 13 Medium US Little Kid",Shoes,SHOES
611,B06XG9N9D7,adidas Kids  Baby Boy's Iconic Tricot Jogger Pants (Toddler/Little Kids) Adi Black Pants,Sports,SPORTING_GOODS
612,B01MSQL65B,"adidas Performance Boys' Nemeziz 17.4 TF J Soccer Shoe, White/Solar Yellow/Black, 5 Medium US Little Kid",Shoes,SHOES
613,B01NAH9RN0,"Adidas Big Boys' Run The Game Tee, Red, M",Apparel,SHIRT
614,B0716ZC13B,adidas Kids  Baby Boy's Melange Performance Tee (Toddler) Dark Grey T-Shirt,Sports,SPORTING_GOODS
615,B074DZD7SM,"Adidas Boys Active Performance 2 Piece T-Shirt Athletic Shorts Outfit Set (5, Neon Green/Blue)",Sports,SPORTING_GOODS
616,B077JJGG5H,"adidas Active Full Zip Hooded Track Jacket for Boys (Black/Yellow, Medium/10-12)",Apparel,SWEATER
617,B077MMRHRR,"Adidas Youth Big Boys Athletic Performance Hoodie (Medium (10-12), Yellow)",Apparel,SWEATER
618,B01HHB8FCY,"adidas Performance Boys' Vigor Bounce j Trail Runner, Black/Shock Slime/Black, 6 M US Big Kid",Shoes,SHOES
619,B0757Z11YK,adidas Boys(Youth) Ace Full Zip Hoody (S),Apparel,SWEATER
620,B0774Z45KZ,Adidas Tubular Shadow Knit Big Kid's Shoes Vapour Pink ac8496 (5.5 M US),Shoes,SHOES
621,B06XWK6ZVX,"Adidas Big Boys Youth Performance Climalite Shorts (Large 14-16, Lime Green-White)",Apparel,SHORTS
622,B01NBIOQH0,"adidas Big Boys' Active Tee Shirt, Gray, XL",Apparel,SHIRT
623,B01LWR1EIO,Adidas Gazelle 2 J Big Kid's Shoes Collegiate Royal/Running White ba9317 (5.5 M US),Shoes,SHOES
624,B008KO5800,"adidas Youth Tiro 13 Training Pant (Black/White, Youth Small)(8 Big Kids)",Sports,SPORTING_GOODS
625,B00VATG3VK,"adidas Originals Pro Model J Fashion Sneaker (Little Kid/Big Kid), White/Black/White, 3.5 M US Little Kid",Shoes,SHOES
626,B0713X5CFG,adidas D Lillard 3 J BW0536 Big Kid Basketball Shoes Sz 6.5 Black/White/Scarlet,Shoes,SHOES
627,B01HIMI2GG,"adidas Performance Boys' Altarun CF I Sneaker, Core Blue/White/Mystery Blue, 5 M US Toddler",Shoes,SHOES
628,B01N9FNYUT,"Adidas Big Boys' Dynamic Speed Short, Gry Grn, M",Apparel,SHORTS
629,B075FK715X,"Adidas Little Boys' LS Sport Split Tee, Dark Grey, 4",Apparel,SHIRT
630,B01D0SO054,"adidas Boys' Cross 'Em up 2016 Wide Basketball Shoe, Light Onix/Black/Light Scarlet, 2.5 W US Little Kid",Shoes,SHOES
631,B019NOB59S,"adidas Big Boys Aero Knit Short Sleeve Tee, Collegiate Navy, Small",Apparel,SHIRT
632,B01N0UE28L,"adidas Performance Boys' Dual Threat 2017 J, Grey Four/Grey Three/Grey One, 6.5 Medium US Big Kid",Shoes,SHOES
633,B01GWUQ5IM,"adidas Little Boys' Performance Raglan Tee Shirt, Solar Red, 7",Apparel,SHIRT
634,B019EJJTN6,"adidas Baby Boys' Tank and Active Short Set, Semi Solar Slime, 6 Months",Apparel,SHORTS
635,B075QMLLKN,"adidas Kid's ACE 17+ Purecontrol FG Soccer Cleats, 6.0 D(M) US, Solar Orange / Core Black / Red",Shoes,SHOES
636,B010S0LC58,"adidas Performance Boys Club Tee, Black, X-Large",Sports,SPORTING_GOODS
637,B01DUYG0G0,"Adidas Little Boys Athletic Long Sleeve Shirt and Pants Set (3T, Orange)",Apparel,SPORTING_GOODS
638,B01IWF0YOQ,"adidas Kids' Jr Adicross V Ftwwht/Midg Skate Shoe, White, 6.5 M US Big Kid",Shoes,SHOES
639,B01GQ57CUS,"adidas Performance Kids' Ace 16.4 J Firm Ground Soccer Cleat, Black/White/Solar Blue, 3 M US Little Kid",Shoes,SHOES
640,B073QWKTN9,Adidas Kids Stan Smith FTWWHT/FTWWHT/CGRANI 5.5,Shoes,SHOES
641,B00W3RDFAA,"adidas JR Adicross IV Golf Spikeless (Little Kid), FTWR White/Core Black/Silver Metallic, 2 M US Little Kid",Shoes,SHOES
642,B01EUEPBCS,"Adidas® Boys’ Tech Fleece Pant-Navy/Gray (Small, 8)",Apparel,PANTS
643,B0147DJHW2,Adidas Tubular X (Kids),Shoes,SHOES
644,B01ATVJ780,Adidas Boys Youth Performance Shock Net Core Navy AthleticT-Shirt (Medium / 10-12 Big Kids),Sports,SPORTING_GOODS
645,B008B9VFD8,"Adidas Little Boys' Itb Iconic Tricot Set, Black, 4",Apparel,SHIRT
646,B0759S2MXC,SUPER STAR I,Shoes,SHOES
647,B00R8NQ12S,"adidas Performance Ace 15.4 FG J Soccer Shoe (Little Kid/Big Kid),Black/White/Solar Yellow,2 M US Little Kid",Shoes,SHOES
648,B01LZDS36B,Adidas J Wall 2 Basketball Boy's Gradeschool Shoes Size 5,Shoes,SHOES
649,B01N5P1TP9,Adidas Tubular Instinct Youth US 5.5 Blue Tennis Shoe,Shoes,SHOES
650,B0772S5PX7,Adidas Predator 18.1 Youth FG Cleats [Cblack] (1),Shoes,SHOES
651,B01N1TBKGC,adidas Kids Unisex Tater 4 (Toddler/Little Kid/Big Kid) Black/Running White/Running White Athletic Shoe,Shoes,SHOES
652,B0775GFWGT,"adidas Toddler Boys Fleece Lined Sweat Pants, Grey Stripe (3T)",Apparel,PANTS
653,B06WLM7LPC,Adidas Superstar Big Kids Style: B27482-Wht/Blk/Tom Size: 5 Y US,Shoes,SHOES
654,B01GU623WK,"adidas Little Boys' Shot Caller Short, Dark Indigo, 6",Apparel,SHORTS
655,B07675X5ZW,"Adidas Men's Logo T-Shirt (S (8-10), Neon Green)",Apparel,SHIRT
656,B01HG7QGIO,"adidas Boys Tennis Melbourne Line Tee, Samba Blue/Glow Orange, Small",Sports,SPORTING_GOODS
657,B01HSLEW0C,"adidas NEO Boys' BB9TIS Inf Sneaker, Black/Light Onix/Solar Blue, 7 M US Toddler",Shoes,SHOES
658,B00DRUE4YI,Adidas Mexico Away Jersey Youth [RED/BLACK] (L),Sports,SPORTING_GOODS
659,B01HQU3OIQ,"adidas Originals Boys' Eqt Support Adv C Sneaker, Black/Black/White, 3 M US Little Kid",Shoes,SHOES
660,B06Y34T4WH,Adidas SL Loop Runner TR I Toddler US 7 Gray Trail Running,Shoes,SHOES
661,B01MYR7D1T,"adidas Performance Kids' Nemeziz Tango 17.3 in J, White/Solar Yellow/Black, 5 Medium US Little Kid",Shoes,SHOES
662,B019QRQ62S,"adidas Performance Boys' Ace 16.4 Fxg J Skate Shoe, Solar Yellow/Black/Silver Metallic, 5 M US Big Kid",Shoes,SHOES
663,B01F6YOUSM,"Adidas Soccer Cleats Size 13 - X 15.1 FG/AG Junior, White/Green/Black",Sports,SPORTING_GOODS
664,B01IWDXJFE,"adidas Kids' Jr Adipower Boa Ftwwht/Si Skate Shoe, White, 3.5 M US Big Kid",Shoes,SHOES
665,B00QKRKIPE,"adidas Youth Soccer Tiro 15 Training Jacket, Black/White/Black, Large",Sports,SPORTING_GOODS
666,B011SH1RB4,adidas Climalite Logo Red T-Shirt Tee - Boys Youth 8-20 (X-Large / 18 Big Kids),Sports,SPORTING_GOODS
667,B01M698RMZ,Boys adidas REVIGO 17 GoalKeeper Jersey Junior For Soccer,Sports,SPORTING_GOODS
668,B01N0VZS2X,adidas Kids Baby Boy's Influencer Shorts (Toddler/Little Kids) Dark Grey Shorts,Sports,SPORTING_GOODS
669,B074WFPBB7,Men's Markelle Fultz Philadelphia 76ers NBA adidas Royal Blue Name & Number Player T-Shirt (Large),Sports,SPORTING_GOODS
670,B01HQIAMNI,"adidas Performance Kids' Messi 16.3 J Firm Ground Soccer Cleat, Blue/White/Warning, 1.5 M US Little Kid",Shoes,SHOES
671,B01KQS2IEQ,adidas Originals Gazelle 2 - Boys' Preschool #S32249 (1Y),Shoes,SHOES
672,B00L2ION9S,Adidas Outdoor Kid's AX 2 Lace Up Purple Sneakers 11K M,Shoes,SHOES
673,B072KH1M49,Adidas - Xplr J - BY9877 - Color: Grey - Size: 4.5,Shoes,SHOES
674,B01MQVPO88,"Adidas Boys Hooded Athletic Jacket, Royal/Green (XL-18)",Sports,SPORTING_GOODS
675,B073ZKTBKQ,Adidas SUPERSTAR J Boys fashion-sneakers S80138_4.5 - FOOTWEAR WHITE/CORE BLACK/FOOTWEAR WHITE,Shoes,SHOES
676,B01A1HNIF0,"adidas Performance Boys' Baseline Cmf Inf Sneaker, Clear Onix/White/Shock Purple Fabric, 7 M US Toddler",Shoes,SHOES
677,B01MZBNOMN,KIDS UNISEX ORIGINALS TUBULAR INVADER STRAP SHOES (6.5),Shoes,SHOES
678,B010EOCODM,"adidas Neo Men's Daily Lifestyle Skateboarding Sneaker,Black/Clear Onix Grey/Black,8.5 M US",Shoes,SHOES
679,B017246FYQ,Adidas Superstar Modern (Star Wars) (Kids),Shoes,SHOES
680,B01MXBPRTO,Adidas Tubular Radial Youth US 5.5 Blue Sneakers,Shoes,SHOES
681,B01NA7B2JB,Adidas Wall 2 Basketball Boy's Gradeschool Shoes Size 5,Shoes,SHOES
682,B01MTR9NXS,"adidas Boys Tennis Barricade Tee, Equipment Yellow, Medium",Sports,SPORTING_GOODS
683,B01MYQF3J2,"adidas Boys Tennis Advantage Bermuda Shorts, Black, X-Large",Sports,SPORTING_GOODS
684,B00W6YEJBO,"adidas Little Boys' Tiro Pant, Black, 7",Apparel,PANTS
685,B06XSG1ZLM,"adidas Originals Boys' Superstar Black Iridescent C Sneaker, Black/Black/Black, 1.5 M US Little Kid",Shoes,SHOES
686,B019NOBRLY,"adidas Big Boys' Climalite Short Sleeve Graphic Tee, White/Black, Large/14-16",Apparel,SHIRT
687,B071NWH13G,Adidas Kids Messi 16.3 Fg Copper Metallic/Core Black/Solar Green Soccer Shoes - 3.5Y,Shoes,SHOES
688,B01N9XJ3WQ,"adidas Performance Boys' Nxt Lvl Spd V K Skate Shoe, Collegiate Royal/White/Collegiate Royal, 12 M US Little Kid",Shoes,SHOES
689,B073M49MNG,Adidas Ultra Boost Uncaged Youth Sneaker (6.5 M US Big Kid),Shoes,SHOES
690,B00LUN65KU,"adidas Boys Cushion Crew Socks (Pack of 3), Bold Blue/Black - White/Bold Blue - Heathered Light Onix/Bold Blue, Medium",Sports,SOCKSHOSIERY
691,B01A51H9SO,"adidas Big Boys' French Terry Streetball Short, Dark Grey/Eqt Yellow, Medium",Apparel,SHORTS
692,B01LWTY7ZL,Adidas Youth Superstar White Gold Leather Trainers 5 US,Shoes,SHOES
693,B072R64VF5,"adidas Junior X 16.4 FG Soccer Cleats (3.5, Core Black/White)",Shoes,SHOES
694,B01LXTP5IW,Adidas Youth Gazelle Black White Suede Trainers 4 US,Shoes,SHOES
695,B0195SRMVC,"adidas Performance Kids' X 16.4 Firm Ground Soccer Shoe (Little Kid/Big Kid), Silver Metallic/Black/Indoorfrared, 4.5 M US Big Kid",Shoes,SHOES
696,B01HN3GKRI,"adidas Performance Boys' Adilette Clf+ K Sandal, Black/Grey/Lemon Peel, 3 M US Little Kid",Shoes,SHOES
697,B00R8NIWYS,adidas Kids Boy's Outrival 2 K (Little Kid/Big Kid) White/Black/Silver Metallic Sneaker 6.5 Big Kid M,Shoes,SHOES
698,B072JNDQMB,adidas Futsal Shoes Turf Kids Football Outdoor Ace 17.4 Boys Boots Junior S77121 (US 6),Shoes,SHOES
699,B075TK4ZK1,Adidas X 16.1 Youth Firm Ground Cleats [BLUE] (2.5),Shoes,SHOES
700,B071KLYPLD,Adidas Vs Switch 2.0 Collegiate Navy/Ftw White Safety Yellow Ankle-High Tennis Shoe - 6.5M,Shoes,SHOES
701,B072R77114,Real Madrid Home KIDS Goalkeeper Jersey 2017 / 2018 - M / 152cm,Sports,SPORTING_GOODS
702,B00GMUF42G,Adidas Oklahoma City Thunder Logo Hoodie Thunder Blue M/5-6K Kid Pullover,Sports,SPORTING_GOODS
703,B019XJUYVS,"adidas Toddler Boys' Active Tee Shirt, Semi Solar Slime Heather, 2T",Apparel,SHIRT
704,B075SJ3Z6K,Adidas Flat Cap Logo Hat OSFY,Sports,SPORTING_GOODS
705,B072M9N9HH,adidas Originals Campus Black Suede 4.5 M US Big Kid,Shoes,SHOES
706,B06Y27661C,Adidas Boys 8-20 Youth Orange / Black Climalite Performance T-Shirt (Youth Large 14-16),Sports,SPORTING_GOODS
707,B071RRQ1TM,adidas Kids Boy's Earn Your Stripes Tee (Big Kids) Grey Large,Sports,SPORTING_GOODS
708,B01IWDXQB6,"adidas Kids' Jr Adipower Boa Ftwwht/Si Skate Shoe, White, 4.5 M US Big Kid",Shoes,SHOES
709,B009SOQJKE,"adidas Big Boys' Key Item Short, Collegiate Navy, Medium/10-12",Apparel,SHORTS
710,B00IOU1KKM,adidas Outdoor Kids Unisex Daroga Leather (Little Kid/Big Kid) Brown/Grey Blend/Night Brown Sneaker 3 Little Kid M,Shoes,SHOES
711,B01GQ4J6U8,"adidas Performance Boys' Alpha Bounce j Running Shoe, Shock Blue/Black/Tech Grey Fabric, 4.5 M US Big Kid",Shoes,SHOES
712,B00VUX5BZ0,"adidas Performance Messi 15.3 Indoor Soccer Shoe (Little Kid/Big Kid),White/Prime Blue/Black,2 M US Little Kid",Shoes,SHOES
713,B00W6Y3VB8,"adidas Little Boys' Performance Power Tee, Raw Green, 3T",Apparel,SHIRT
714,B01N3AX2RG,"adidas Golf Boys Performance Polo, Red Night, X-Large",Sports,SPORTING_GOODS
715,B01N5KL2H9,adidas Kids Baby Boy's Smokescreen Shorts (Toddler/Little Kids) Dark Grey Shorts,Sports,SPORTING_GOODS
716,B06XFWJ9YR,adidas Kids  Boy's Logo Sport Ball Tee (Big Kids) Collegiate Burgundy Heather X-Large,Apparel,SHIRT
717,B06WP83CQ8,"adidas Youth Big Boys Fleece Full Zip Hoodie, Green",Apparel,SWEATER
718,B06XGCRPZX,adidas Kids  Boy's Short Sleeve Digi Sports Ball Tee (Big Kids) Neon Green X-Large,Sports,SPORTING_GOODS
719,B0765CQ8H2,Adidas Russia Hockey Youth World Cup of Hockey Pullover Climawarn Hoodie Sweatshirt (Youth Large (14/16)),Apparel,SWEATER
720,B01IWEZJME,"adidas Kids' Jr Adicross V Cblack/Ftww Skate Shoe, Black, 5.5 M US Big Kid",Shoes,SHOES
721,B071DTSGB4,adidas Kids Unisex Harden Vol. 1 (Big Kid) White/Black/Bold Gold 4 M US Big Kid,Shoes,SHOES
722,B01L60HD0W,Adidas NMD_R1 J ''Black/White'' S80206 (5 M US Big Kid),Shoes,SHOES
723,B019XJV4OE,"Adidas Little Boys' Toddler Dribbler Top, Light Green, 4T",Apparel,SHIRT
724,B010OSV3NK,"adidas NEO Advantage VS K Sneaker (Little Kid/Big Kid),Black/White/Solar Blue,2 M US Little Kid",Shoes,SHOES
725,B01A51HCE0,"adidas Big Boys' Streetball Pant, Dark Grey/Eqt Yellow, X-Large",Apparel,PANTS
726,B01GQ4KGL6,"adidas Performance Boys' Court Fury 2016 K Skate Shoe, Black/Ray Red/White, 12 M US Little Kid",Shoes,SHOES
727,B0086WVKLC,"Adidas Wrestling Extero II K Wrestling Shoe (Toddler/Little Kid/Bid Kid),Black/Core Energy/Metallic Silver,5.5 M US Big Kid",Shoes,SHOES
728,B06XTY5PLT,"Adidas 3-Stripe Performance Big Boys Youth Track Pants (Large - 14/16, Navy/Green)",Apparel,PANTS
729,B077BPJ1VR,"Adidas X PLR 2 Tone Kint Sneakers (Big Kid),Black/blue,6",Shoes,SHOES
730,B01GRLGGSU,"adidas Performance Kids' Ace 16.4 J Indoor Soccer Cleat, Red/White/Black, 4.5 M US Big Kid",Shoes,SHOES
731,B01HHCD1OA,"Adidas Big Boys Youth Designator Poly Blend Performance Pants, Black",Apparel,PANTS
732,B01ATTREQO,"adidas Big Boys' Separates Training Track Jacket, Collegiate Navy/Shock Slime, X-Large/18",Apparel,OUTERWEAR
733,B06X93YJV3,Adidas Boys 8-20 Youth White / Blue Climalite Performance T-Shirt (Youth Large 14-16),Sports,SPORTING_GOODS
734,B071G6K1J6,Adidas LK DY Dory Jacket,Sports,SPORTING_GOODS
735,B01M5FEKNU,Adidas - Boy's Zx Flux Camouflage Sneakers,Shoes,SHOES
736,B01ADQTRZY,"adidas Big Boys' Climalite Short Sleeve Graphic Tee, EURO 2016 MASCOT TEE AI5668 , X-Large/14-16",Sports,SPORTING_GOODS
737,B01HQURBGM,"adidas Originals Boys' Eqt Support Adv I Sneaker, Grey/Tech Grey/White, 8 M US Toddler",Shoes,SHOES
738,B07419JG3B,"Adidas Boy's Basketball Athletic Shorts, Blue/Black Large 14/16",Apparel,SHORTS
739,B01HQICVBY,"adidas Performance Kids' Messi 16.3 J Indoor Soccer Cleat, Blue/White/Warning, 11 M US Little Kid",Shoes,SHOES
740,B01HG7Q6BG,"adidas Boys Tennis Barricade Tee, Samba Blue/White, X-Large",Sports,SPORTING_GOODS
741,B00IO310SQ,Adidas Streetrun VII K (GS) Girls Running Shoes M20275 Pink 6.5 M US,Shoes,SHOES
742,B074CNB8GK,Adidas Athletics Pullover - Black - Kids - 7X,Apparel,SWEATER
743,B076GSQ348,Adidas Zx Flux Techfit Boy's Gradeschool Shoes Size 5.5,Shoes,SHOES
744,B077LZ4716,Adidas Boys Tracksuit Active 2 Piece Pants and Jacket Set Size 7,Apparel,SWEATER
745,B01GU5Z7X8,"adidas Toddler Boys' Basic Long Sleeve Tee Shirt, White, 2T",Apparel,SHIRT
746,B06VW6BPT7,adidas Kids Originals Terry Pants #AJ0330 (L),Apparel,PANTS
